Wu_et_Sues_1996a,,,Crocodylomorpha,Crurotarsi,,,,Archosauromorpha,Diapsida,Sauropsida,Amniota,Tetrapoda,Sarcopterygii,Osteichthyes,Gnathostomata,Chordata,Animalia,"Anatomy and phylogenetic relationships of Chimaerasuchus paradoxus, an unusual crocodyliform reptile from the Lower Cretaceous of Hubei, China",1996,Journal of Vertebrate Paleontology,0.62,0.769,129,8,80,0.372,0.6,0.498,0.456,0.635,60,2,58,20,16.8,49.5,24.1,51.2,,,,,,
Wu_etal_1994a,,,Crocodylomorpha,Crurotarsi,,,,Archosauromorpha,Diapsida,Sauropsida,Amniota,Tetrapoda,Sarcopterygii,Osteichthyes,Gnathostomata,Chordata,Animalia,Phylogenetic relationship of Hsisosuchus,1994,Vertebrata PalAsiatica,0.649,0.692,94,1,61,0.213,0.328,0.512,0.356,0.519,54,4,50,11,8.1,64.1,37.2,66.8,,,,,,
Wu_etal_1994b,,,Crocodylomorpha,Crurotarsi,,,,Archosauromorpha,Diapsida,Sauropsida,Amniota,Tetrapoda,Sarcopterygii,Osteichthyes,Gnathostomata,Chordata,Animalia,"A new species of Shantungosuchus from the Lower Cretaceous of Inner Mongolia (China), with comments on S. chuhsienensis Young, 1961 and the phylogenetic position of the genus",1994,Journal of Vertebrate Paleontology,0.658,0.784,79,1,52,0.304,0.462,0.536,0.493,0.645,49,2,47,12,12.9,67.7,36.2,74,,,,,,
Wu_etal_1996a,,,Crocodylomorpha,Crurotarsi,,,,Archosauromorpha,Diapsida,Sauropsida,Amniota,Tetrapoda,Sarcopterygii,Osteichthyes,Gnathostomata,Chordata,Animalia,A new alligator from the Upper Cretaceous of Canada and the relationships of early eusuchians,1996,Palaeontology,0.564,0.779,78,2,44,0.346,0.614,0.451,0.481,0.636,46,2,44,20,18.3,40.9,15.7,45.8,,,,,,
Wu_etal_1997a,,,Crocodylomorpha,Crurotarsi,,,,Archosauromorpha,Diapsida,Sauropsida,Amniota,Tetrapoda,Sarcopterygii,Osteichthyes,Gnathostomata,Chordata,Animalia,"Sichuanosuchus shuhanensis, a new ?Early Cretaceous protosuchian (Archosauria: Crocodyliformes) from Sichuan (China), and the monophyly of Protosuchia",1997,Journal of Vertebrate Paleontology,0.461,0.734,362,18,167,0.279,0.605,0.289,0.232,0.616,128,4,124,33,17.8,46.5,22.4,50.9,,,,,,
Wu_etal_2001a,,,Crocodylomorpha,Crurotarsi,,,,Archosauromorpha,Diapsida,Sauropsida,Amniota,Tetrapoda,Sarcopterygii,Osteichthyes,Gnathostomata,Chordata,Animalia,"Terminonaris (Archosauria: Crocodyliformes): new material from Saskatchewan, Canada, and comments on its phylogenetic relationships",2001,Journal of Vertebrate Paleontology,0.461,0.743,373,33,172,0.324,0.704,0.298,0.241,0.627,131,2,129,36,19.5,43.9,20.9,47.9,,,,,,
Young_et_Andrade_2009a,,,Crocodylomorpha,Crurotarsi,,,,Archosauromorpha,Diapsida,Sauropsida,Amniota,Tetrapoda,Sarcopterygii,Osteichthyes,Gnathostomata,Chordata,Animalia,"What is Geosaurus? Redescription of Geosaurus giganteus (Thalattosuchia: Metriorhynchidae) from the Upper Jurassic of Bayern, Germany",2009,Zoological Journal of the Linnean Society,0.447,0.865,580,12,259,0.255,0.571,0.194,0.267,0.793,166,0,166,86,40.7,46,15.4,50.8,,,,,,
Young_etal_2011aa,,,Crocodylomorpha,Crurotarsi,,,,Archosauromorpha,Diapsida,Sauropsida,Amniota,Tetrapoda,Sarcopterygii,Osteichthyes,Gnathostomata,Chordata,Animalia,Body size estimation and evolution in metriorhynchid crocodylomorphs: implications for species diversification and niche partitioning,2011,Zoological Journal of the Linnean Society,0.625,0.864,403,3,252,0.176,0.282,0.306,0.319,0.796,190,17,173,50,47.6,45.2,14.6,49.2,,,,,,
Young_etal_2011ab,,,Crocodylomorpha,Crurotarsi,,,,Archosauromorpha,Diapsida,Sauropsida,Amniota,Tetrapoda,Sarcopterygii,Osteichthyes,Gnathostomata,Chordata,Animalia,Body size estimation and evolution in metriorhynchid crocodylomorphs: implications for species diversification and niche partitioning,2011,Zoological Journal of the Linnean Society,0.549,0.854,477,6,262,0.199,0.363,0.274,0.265,0.775,190,16,174,50,47.6,48.5,16.3,53,,,,,,
Zaher_etal_2006a,,,Crocodylomorpha,Crurotarsi,,,,Archosauromorpha,Diapsida,Sauropsida,Amniota,Tetrapoda,Sarcopterygii,Osteichthyes,Gnathostomata,Chordata,Animalia,"Redescription of the cranial morphology of Mariliasuchus amarali, and its phylogenetic affinities (Crocodyliformes, Notosuchia)",2006,American Museum Novitates,0.363,0.677,652,4,237,0,0,0.288,0.265,0.532,198,8,190,46,37.8,39.6,17.3,44.9,,,,,,
Matsumoto_etal_2009aa.tnt,Choristodera,,Diapsida,Archosauromorpha_minus_Crurotarsi_and_Ornithodira,,,,Archosauromorpha,Diapsida,Sauropsida,Amniota,Tetrapoda,Sarcopterygii,Osteichthyes,Gnathostomata,Chordata,Animalia,New material of the enigmatic reptile <em>Khurendukhosaurus</em> (Diapsida: Choristodera) from Mongolia,2009,Naturwissenschaften,0.738,0.761,107,5,79,0.131,0.177,0.409,0.243,0.611,81,22,59,12,28.2,48.6,24.4,48.1,,,,,,
Matsumoto_etal_2009ab.tnt,Choristodera,,Diapsida,Archosauromorpha_minus_Crurotarsi_and_Ornithodira,,,,Archosauromorpha,Diapsida,Sauropsida,Amniota,Tetrapoda,Sarcopterygii,Osteichthyes,Gnathostomata,Chordata,Animalia,New material of the enigmatic reptile <em>Khurendukhosaurus</em> (Diapsida: Choristodera) from Mongolia,2009,Naturwissenschaften,0.745,0.761,106,5,79,0.151,0.203,0.44,0.258,0.617,81,22,59,11,23.3,58.7,34.7,58,,,,,,
Matsumoto_etal_2009ac.tnt,Choristodera,,Diapsida,Archosauromorpha_minus_Crurotarsi_and_Ornithodira,,,,Archosauromorpha,Diapsida,Sauropsida,Amniota,Tetrapoda,Sarcopterygii,Osteichthyes,Gnathostomata,Chordata,Animalia,New material of the enigmatic reptile <em>Khurendukhosaurus</em> (Diapsida: Choristodera) from Mongolia,2009,Naturwissenschaften,0.569,0.694,188,2,107,0.16,0.28,0.414,0.313,0.526,81,5,76,17,24.5,47.3,25.2,52.8,,,,,,
Matsumoto_etal_2009ad.tnt,Choristodera,,Diapsida,Archosauromorpha_minus_Crurotarsi_and_Ornithodira,,,,Archosauromorpha,Diapsida,Sauropsida,Amniota,Tetrapoda,Sarcopterygii,Osteichthyes,Gnathostomata,Chordata,Animalia,New material of the enigmatic reptile <em>Khurendukhosaurus</em> (Diapsida: Choristodera) from Mongolia,2009,Naturwissenschaften,0.572,0.693,187,2,107,0.187,0.327,0.477,0.309,0.526,81,5,76,16,21,55.9,31.5,60.2,,,,,,
Matsumoto_etal_2013a.tnt,Choristodera,,Diapsida,Archosauromorpha_minus_Crurotarsi_and_Ornithodira,,,,Archosauromorpha,Diapsida,Sauropsida,Amniota,Tetrapoda,Sarcopterygii,Osteichthyes,Gnathostomata,Chordata,Animalia,"New material of the choristodere <em>Lazarussuchus</em> (Diapsida, Choristodera) from the Paleocene of France",2013,Journal of Vertebrate Paleontology,0.539,0.75,308,3,166,0.218,0.404,0.361,0.313,0.615,116,1,115,27,35.9,34.4,16.7,38.2,,,,,,
Ahlberg_1998aa.tnt,,,Early_Tetrapods,Tetrapoda_minus_Amniota,,,,,,,,Tetrapoda,Sarcopterygii,Osteichthyes,Gnathostomata,Chordata,Animalia,"Postcranial stem tetrapod remains from the Devonian of Scat Craig, Morayshire, Scotland",1998,Zoological Journal of the Linnean Society,0.596,0.697,141,8,84,0.213,0.357,0.446,0.276,0.539,80,6,74,18,28.9,24.8,11.1,28.3,,,,,,
Ahlberg_1998ab.tnt,,,Early_Tetrapods,Tetrapoda_minus_Amniota,,,,,,,,Tetrapoda,Sarcopterygii,Osteichthyes,Gnathostomata,Chordata,Animalia,"Postcranial stem tetrapod remains from the Devonian of Scat Craig, Morayshire, Scotland",1998,Zoological Journal of the Linnean Society,0.765,0.778,51,4,39,0.176,0.231,0.547,0.283,0.616,46,10,36,9,23.9,50.3,34.3,51.6,,,,,,
Ahlberg_et_Clack_1998a.tnt,,,Early_Tetrapods,Tetrapoda_minus_Amniota,,,,,,,,Tetrapoda,Sarcopterygii,Osteichthyes,Gnathostomata,Chordata,Animalia,"Lower jaws, lower tetrapods - a review based on the Devonian genus Acanthostega",1998,Transactions of the Royal Society of Edinburgh: Earth Sciences,0.5,0.741,106,23,53,0.16,0.321,0.348,0.296,0.545,50,4,46,26,19.1,22.3,7.2,27.1,,,,,,
Ahlberg_etal_2000a.tnt,,,Early_Tetrapods,Tetrapoda_minus_Amniota,,,,,,,,Tetrapoda,Sarcopterygii,Osteichthyes,Gnathostomata,Chordata,Animalia,A near-tetrapod from the Baltic Middle Devonian,2000,Palaeontology,0.756,0.796,41,3,31,0.122,0.161,0.578,0.338,0.611,34,5,29,10,33.8,37.5,19.7,42,,,,,,
Carroll_1995a.tnt,,,Early_Tetrapods,Tetrapoda_minus_Amniota,,,,,,,,Tetrapoda,Sarcopterygii,Osteichthyes,Gnathostomata,Chordata,Animalia,Problems of the phylogenetic analysis of Paleozoic choanates,1995,"Bulletin du Museum national d'Histoire naturelle, Paris, 4e ser.",0.748,0.751,389,4,291,0.203,0.272,0.394,0.17,0.655,184,41,143,18,14.7,74.8,45.2,78.6,,,,,,
Clack_1997a.tnt,,,Early_Tetrapods,Tetrapoda_minus_Amniota,,,,,,,,Tetrapoda,Sarcopterygii,Osteichthyes,Gnathostomata,Chordata,Animalia,The Scottish Carboniferous tetrapod Crassigyrinus scoticus (Lydekker) - cranial anatomy and relationships,1997,Transactions of the Royal Society of Edinburgh: Earth Sciences,0.505,0.577,210,1,106,0.133,0.264,0.388,0.236,0.387,88,8,80,14,9.2,46.8,30.6,48.2,,,,,,
Clack_1998a.tnt,,,Early_Tetrapods,Tetrapoda_minus_Amniota,,,,,,,,Tetrapoda,Sarcopterygii,Osteichthyes,Gnathostomata,Chordata,Animalia,A new Early Carboniferous tetrapod with a melange of crown-group characters,1998,Nature,0.512,0.571,258,2,132,0.229,0.447,0.393,0.238,0.391,111,11,100,15,12.4,51.3,33.5,54.3,,,,,,
Clack_2001a.tnt,,,Early_Tetrapods,Tetrapoda_minus_Amniota,,,,,,,,Tetrapoda,Sarcopterygii,Osteichthyes,Gnathostomata,Chordata,Animalia,"Eucritta melanolimnetes from the Early Carboniferous of Scotland, a stem tetrapod showing a mosaic of characteristics",2001,Transactions of the Royal Society of Edinburgh: Earth Sciences,0.512,0.579,252,2,129,0.155,0.302,0.474,0.238,0.4,110,11,99,15,12.3,55.4,33.1,58,,,,,,
Clack_2002a.tnt,,,Early_Tetrapods,Tetrapoda_minus_Amniota,,,,,,,,Tetrapoda,Sarcopterygii,Osteichthyes,Gnathostomata,Chordata,Animalia,An early tetrapod from 'Romer's Gap',2002,Nature,0.393,0.562,484,1,190,0.136,0.347,0.378,0.256,0.366,141,2,139,25,24.9,41.1,22.7,46,,,,,,
Clack_et_Ahlberg_2004a.tnt,,,Early_Tetrapods,Tetrapoda_minus_Amniota,,,,,,,,Tetrapoda,Sarcopterygii,Osteichthyes,Gnathostomata,Chordata,Animalia,A new stem tetrapod from the Early Carboniferous of Northern Ireland,2004,Recent Advances in the Origin and Early Radiation of Vertebrates,0.526,0.727,95,35,50,0.074,0.14,0.33,0.267,0.534,53,10,43,21,18.6,25.8,8.2,25,,,,,,
Coates_1996a.tnt,,,Early_Tetrapods,Tetrapoda_minus_Amniota,,,,,,,,Tetrapoda,Sarcopterygii,Osteichthyes,Gnathostomata,Chordata,Animalia,"The Devonian tetrapod Acanthostega gunnari Jarvik: postcranial anatomy, basal tetrapod interrelationships and patterns of skeletal evolution",1996,Transactions of the Royal Society of Edinburgh: Earth Sciences,0.606,0.713,132,4,80,0.114,0.188,0.472,0.277,0.564,76,6,70,18,27.9,30,10.8,36.5,,,,,,
Daeschler_etal_2006a.tnt,,,Early_Tetrapods,Tetrapoda_minus_Amniota,,,,,,,,Tetrapoda,Sarcopterygii,Osteichthyes,Gnathostomata,Chordata,Animalia,A Devonian tetrapod-like fish and the evolution of the tetrapod body plan,2006,Nature,0.797,0.814,118,2,94,0.195,0.245,0.442,0.219,0.72,114,34,80,9,19.1,73.9,49.6,76.5,,,,,,
Klembara_et_Ruta_2003a.tnt,Seymouriamorph,,Early_Tetrapods,Tetrapoda_minus_Amniota,,,,,,,Seymouriamorpha,Tetrapoda,Sarcopterygii,Osteichthyes,Gnathostomata,Chordata,Animalia,The seymouriamorph tetrapod Utegenia shpinari from the ?Upper Carboniferous-Lower Permian of Kazakhstan. Part II: postcranial anatomy and relationships,2003,Transactions of the Royal Society of Edinburgh: Earth Sciences,0.398,0.685,510,2,203,0.176,0.443,0.276,0.228,0.548,150,6,144,32,17.6,50.7,30.1,52.4,,,,,,
Klembara_et_Ruta_2005a.tnt,Seymouriamorph,,Early_Tetrapods,Tetrapoda_minus_Amniota,,,,,,,Seymouriamorpha,Tetrapoda,Sarcopterygii,Osteichthyes,Gnathostomata,Chordata,Animalia,The seymouriamorph tetrapod Ariekanerpeton sigalovi from the Lower Permian of Tadzhikistan. Part II: postcranial anatomy and relationships,2005,Transactions of the Royal Society of Edinburgh: Earth Sciences,0.4,0.695,523,6,209,0.098,0.244,0.252,0.235,0.562,150,3,147,33,17.8,46.6,27.6,49.2,,,,,,
Laurin_1998a.tnt,,,Early_Tetrapods,Tetrapoda_minus_Amniota,,,,,,,,Tetrapoda,Sarcopterygii,Osteichthyes,Gnathostomata,Chordata,Animalia,"The importance of global parsimony and historical bias in understanding tetrapod evoltution. Part I. Systematics, middle ear evolution and jaw suspension",1998,Annales des Sciences Naturelles,0.395,0.727,559,14,221,0.199,0.503,0.265,0.262,0.603,155,2,153,43,19.2,53.4,23.1,60.8,,,,,,
Lebedev_et_Coates_1995a.tnt,,,Early_Tetrapods,Tetrapoda_minus_Amniota,,,,,,,,Tetrapoda,Sarcopterygii,Osteichthyes,Gnathostomata,Chordata,Animalia,The postcranial skeleton of the Devonian tetrapod Tulerpeton curtum Lebedev,1995,Zoological Journal of the Linnean Society,0.714,0.758,56,14,40,0.232,0.325,0.578,0.273,0.594,43,8,35,11,15.6,45,30.7,46.8,,,,,,
Lombard_et_Bolt_2006aa.tnt,,,Early_Tetrapods,Tetrapoda_minus_Amniota,,,,,,,,Tetrapoda,Sarcopterygii,Osteichthyes,Gnathostomata,Chordata,Animalia,"The mandible of <em>Whatcheeria deltae</em>, an early tetrapod from the late Mississippian of Iowa",2006,"Amniote Paleobiology: Perspectives on the Evolution of Mammals, Birds, and Reptiles",0.482,0.735,110,897,53,0.073,0.151,0.322,0.307,0.535,50,4,46,26,18.2,24,8.2,27.8,,,,,,
Lombard_et_Bolt_2006ab.tnt,,,Early_Tetrapods,Tetrapoda_minus_Amniota,,,,,,,,Tetrapoda,Sarcopterygii,Osteichthyes,Gnathostomata,Chordata,Animalia,"The mandible of <em>Whatcheeria deltae</em>, an early tetrapod from the late Mississippian of Iowa",2006,"Amniote Paleobiology: Perspectives on the Evolution of Mammals, Birds, and Reptiles",0.228,0.676,1581,108,360,0.112,0.491,0.195,0.176,0.544,339,6,333,102,29.8,33.1,16.9,37,,,,,,
Long_etal_2006a.tnt,,,Early_Tetrapods,Tetrapoda_minus_Amniota,,,,,,,,Tetrapoda,Sarcopterygii,Osteichthyes,Gnathostomata,Chordata,Animalia,An exceptional Devonian fish from Australia sheds light on tetrapod origins,2006,Nature,0.731,0.79,160,2,117,0.388,0.53,0.476,0.251,0.699,103,8,95,12,15,73.3,47,75.5,,,,,,
Paton_etal_1999a.tnt,,,Early_Tetrapods,Tetrapoda_minus_Amniota,,,,,,,,Tetrapoda,Sarcopterygii,Osteichthyes,Gnathostomata,Chordata,Animalia,An amniote-like skeleton from the Early Carboniferous of Scotland,1999,Nature,0.446,0.553,327,9,146,0.061,0.137,0.362,0.242,0.342,111,6,105,21,20.6,30.8,15.9,34.4,Acanthost,Crassigyr,Greererpe,Balanerpe,Dendrerpe,Eucritta 
Ruta_2011a.tnt,,,Early_Tetrapods,Tetrapoda_minus_Amniota,,,,,,,,Tetrapoda,Sarcopterygii,Osteichthyes,Gnathostomata,Chordata,Animalia,Phylogenetic signal and character compatability in the appendicular skeleton of early tetrapods,2011,Special Papers in Palaeontology,0.455,0.722,512,72,233,0.113,0.509,0.29,0.281,0.589,157,6,151,44,38.5,36.5,13.7,41.6,Onychodus,Acanthost,Archeria ,Asapheste,Balanerpe,Baphetes 
Ruta_et_Bolt_2006a.tnt,,,Early_Tetrapods,Tetrapoda_minus_Amniota,,,,,,,,Tetrapoda,Sarcopterygii,Osteichthyes,Gnathostomata,Chordata,Animalia,A reassessment of the temnospondyl amphibian Perryella olsoni from the Lower Permian of Oklahoma,2006,Transactions of the Royal Society of Edinburgh: Earth Sciences,0.311,0.627,895,2,278,0.171,0.312,0.255,0.206,0.481,245,2,243,54,29.4,41.2,19.4,47.1,Panderich,Acanthost,Acheloma_,Acroplous,Adamanter,Amphibamu
Ruta_et_Clack_2006a.tnt,,,Early_Tetrapods,Tetrapoda_minus_Amniota,,,,,,,,Tetrapoda,Sarcopterygii,Osteichthyes,Gnathostomata,Chordata,Animalia,"A review of Silvanerpeton miripedes, a stem amniote from the Lower Carboniferous of East Kirkton, West Lothian, Scotland",2006,Transactions of the Royal Society of Edinburgh: Earth Sciences,0.349,0.567,853,1,298,0.109,0.509,0.27,0.302,0.398,314,59,255,33,26.5,38.5,21,41.5,Eusthenop,Acanthost,Adelogyri,Anthracos,Archeria_,Ariekaner
Ruta_et_Theron_1997a.tnt,,,Early_Tetrapods,Tetrapoda_minus_Amniota,,,,,,,,Tetrapoda,Sarcopterygii,Osteichthyes,Gnathostomata,Chordata,Animalia,Two Devonian mitrates from South Africa,1997,Palaeontology,0.857,0.929,49,1,42,0.551,0.333,0.524,0.465,0.882,38,2,36,13,9.3,78.6,38.8,79.7,Eumitrocy,Mitrocyst,Mitrocyst,Allancyti,Atelocyst,Australoc
Ruta_etal_2003a.tnt,,,Early_Tetrapods,Tetrapoda_minus_Amniota,,,,,,,,Tetrapoda,Sarcopterygii,Osteichthyes,Gnathostomata,Chordata,Animalia,Early tetrapod relationships revisited,2003,Biological Reviews,0.228,0.677,1578,108,360,0.116,0.55,0.188,0.173,0.544,339,6,333,102,29.8,33,16.8,36.7,Eusthenop,Acanthost,Acheronti,Adelogyri,Adelospon,Albanerpe
Warren_et_Turner_2004a,,,Early_Tetrapods,Tetrapoda_minus_Amniota,,,,,,,,Tetrapoda,Sarcopterygii,Osteichthyes,Gnathostomata,Chordata,Animalia,The first stem tetrapod from the Lower Carboniferous of Gondwana,2004,Palaeontology,0.372,0.557,521,1,194,0.094,0.253,0.349,0.333,0.352,144,2,142,28,29.2,32.6,17.5,38.8,,,,,,
Zhu_et_Ahlberg_2004a,,,Early_Tetrapods,Tetrapoda_minus_Amniota,,,,,,,,Tetrapoda,Sarcopterygii,Osteichthyes,Gnathostomata,Chordata,Animalia,The origin of the internal nostril of tetrapods,2004,Nature,0.556,0.778,187,3,104,0.508,0.914,0.367,0.315,0.653,99,7,92,29,28.9,46.7,22.2,49.9,,,,,,
Zhu_etal_1999aa,,,Early_Tetrapods,Tetrapoda_minus_Amniota,,,,,,,,Tetrapoda,Sarcopterygii,Osteichthyes,Gnathostomata,Chordata,Animalia,A primitive fossil fish sheds light on the origin of bony fishes,1999,Nature,0.532,0.798,310,12,165,0.177,0.333,0.327,0.324,0.7,149,2,147,37,32.7,51.1,24.1,55.1,,,,,,
Zhu_etal_1999ab,,,Early_Tetrapods,Tetrapoda_minus_Amniota,,,,,,,,Tetrapoda,Sarcopterygii,Osteichthyes,Gnathostomata,Chordata,Animalia,A primitive fossil fish sheds light on the origin of bony fishes,1999,Nature,0.534,0.802,307,6,164,0.244,0.457,0.311,0.298,0.706,149,3,146,37,32.7,51.6,23.9,54.8,,,,,,
Janvier_1996a.tnt,,,Early_Vertebrates,Agnatha,,,,,,,,,,,,Chordata,Animalia,The dawn of the vertebrates: characters versus common ascent in the rise of current vertebrate phylogenies,1996,Palaeontology,0.605,0.726,147,53,89,0.102,0.169,0.492,0.337,0.551,89,2,87,23,46.5,23.3,9.7,25.3,,,,,,
Shu_etal_2003a.tnt,,,Early_Vertebrates,Agnatha,,,,,,,,,,,,Chordata,Animalia,Head and backbone of the Early Cambrian vertebrate <em>Haikouichthys</em>,2003,Nature,0.611,0.665,175,8,107,0.126,0,0.489,0.303,0.478,115,8,107,18,46.4,31.2,15.3,33.5,Tunicata,Cephaloch,Haikouich,Hagfish  ,Myxinikel,Lamprey  
Gai_et_Zhu_2007a.tnt,,,Galeaspida,Agnatha,,,,,,,,,,,,Chordata,Animalia,"First discovery of Huananaspidae from the Xishancun Formation (Lochkovian, Devonian) of Yunnan, China",2007,Vertebrata PalAsiatica,0.477,0.793,128,1,61,0.391,0.819,0.29,0.325,0.651,54,4,50,40,23,33.5,7.8,35.3,,,,,,
Gai_etal_2005a.tnt,,,Galeaspida,Agnatha,,,,,,,,,,,,Chordata,Animalia,"New material of eugaleaspids from the Silurian of Changxing, Zhejiang, China, with a discussion of the eugaleaspid phylogeny",2005,Vertebrata PalAsiatica,0.8,0.889,35,3,28,0.714,0.893,0.518,0.433,0.798,23,0,23,15,10.7,52.9,19.4,55.9,,,,,,
Khonsari_etal_2009a.tnt,Agnatha,,Galeaspida,Agnatha,,,,,,,,,,,,Chordata,Animalia,Agnathan brain anatomy and craniate phylogeny,2009,Acta Zoologica,0.709,0.709,103,5,73,0.369,0.52,0.336,0.172,0.587,123,50,73,9,15.4,59.8,50.7,59.9,,,,,,
Zhu_et_Gai_2006a,,,Galeaspida,Agnatha,,,,,,,,,,,,Chordata,Animalia,Phylogeneic relationships of galeaspids (Agnatha),2006,Vertebrata PalAsiatica,0.492,0.801,122,1,60,0.393,0.8,0.626,0.797,0.671,53,12,41,39,23.6,34.6,8.1,38.4,,,,,,
Basden_etal_2000a.tnt,Primitive Osteichthyes,,Gnathostomata,Gnathostomata_minus_Actinopt._and_ Sarcopt.,,,,,,,,,,Osteichthyes,Gnathostomata,Chordata,Animalia,The most primitive osteichthyan braincase?,2000,Nature,0.846,0.875,13,3,11,0.538,0.636,0.5,0.397,0.724,13,5,8,9,6.8,58.1,26,55.5,,,,,,
Brazeau_2009a.tnt,,,Gnathostomata,Gnathostomata_minus_Actinopt._and_ Sarcopt.,,,,,,,,,,,Gnathostomata,Chordata,Animalia,The braincase and jaws of a Devonian 'acanthodian' and modern gnathostome origins,2009,Nature,0.418,0.739,335,912,140,0.128,0.307,0.323,0.327,0.579,134,1,133,47,48.5,29.2,10.2,33.1,,,,,,
Carr_et_Hlavin_2010a.tnt,Placodermi,,Gnathostomata,Gnathostomata_minus_Actinopt._and_ Sarcopt.,,,,,,,,,,Placodermi,Gnathostomata,Chordata,Animalia,"Two new species of <em>Dunkleosteus</em> Lehman, 1956, from the Ohio Shale Formation (USA, Famennian) and the Kettle Point Formation (Canada, Upper Devonian), and a cladistic analysis of the Eubrachythoraci (Placodermi, Arthrodira)",2010,Zoological Journal of the Linnean Society,0.466,0.537,223,2,104,0.126,0.269,0.446,0.294,0.256,98,16,82,23,42.8,20.9,7.7,20.5,,,,,,
Johnson_etal_2000a.tnt,Placodermi,,Gnathostomata,Gnathostomata_minus_Actinopt._and_ Sarcopt.,,,,,,,,,,Placodermi,Gnathostomata,Chordata,Animalia,"A new actinolepid arthrodire (Class Placodermi) from the Lower Devonian Sevy Dolomite, East-Central Nevada",2000,Zoological Journal of the Linnean Society,0.42,0.619,69,4,29,0.174,0.414,0.345,0.304,0.303,39,10,29,19,12,23.6,9.4,23.8,,,,,,
Zhu_etal_2006a,Primitive Osteichthyes,,Gnathostomata,Gnathostomata_minus_Actinopt._and_ Sarcopt.,,,,,,,,,,Osteichthyes,Gnathostomata,Chordata,Animalia,A primitive fish provides key characters bearing on deep osteichthyan phylogeny,2006,Nature,0.616,0.781,219,2,135,0.137,0.222,0.442,0.407,0.662,125,2,123,19,37.1,44.5,19,49.6,,,,,,
Caine_et_Benton_2011aa.tnt,,,Ichthyopterygia,Ichthyopterygia,,,,,?,Sauropsida,Amniota,Tetrapoda,Sarcopterygii,Osteichthyes,Gnathostomata,Chordata,Animalia,"Ichthyosauria from the Upper Lias of Strawberry Bank, England",2011,Palaeontology,0.607,0.842,229,2,139,0.253,0.417,0.329,0.285,0.753,105,0,105,33,33,47.3,15.9,56.4,,,,,,
Caine_et_Benton_2011ab.tnt,,,Ichthyopterygia,Ichthyopterygia,,,,,?,Sauropsida,Amniota,Tetrapoda,Sarcopterygii,Osteichthyes,Gnathostomata,Chordata,Animalia,"Ichthyosauria from the Upper Lias of Strawberry Bank, England",2011,Palaeontology,0.668,0.911,187,2,125,0.219,0.328,0.274,0.246,0.864,128,7,121,34,24.5,43.9,14.7,48.8,,,,,,
Chen_etal_2013b.tnt,,,Ichthyopterygia,Ichthyopterygia,,,,,?,Sauropsida,Amniota,Tetrapoda,Sarcopterygii,Osteichthyes,Gnathostomata,Chordata,Animalia,"A new Triassic primitive ichthyosaur from Yunnan, South CHina",2013,Acta Geologica Sinica,0.607,0.842,229,20,139,0.227,0.374,0.361,0.292,0.752,105,0,105,33,34.1,46.8,16.7,54.3,,,,,,
Cuthbertson_etal_2013a.tnt,,,Ichthyopterygia,Ichthyopterygia,,,,,?,Sauropsida,Amniota,Tetrapoda,Sarcopterygii,Osteichthyes,Gnathostomata,Chordata,Animalia,"Cranial morphology and relationships of a new grippidian (Ichthyopterygia) from the Vega-Phroso Siltstone Member (Lower Triassic) of British Columbia, Canada",2013,Journal of Vertebrate Paleontology,0.602,0.836,216,8,130,0.185,0.308,0.321,0.277,0.737,105,7,98,34,34,30.1,10.8,34.9,,,,,,
Cuthbertson_etal_2013b.tnt,,,Ichthyopterygia,Ichthyopterygia,,,,,?,Sauropsida,Amniota,Tetrapoda,Sarcopterygii,Osteichthyes,Gnathostomata,Chordata,Animalia,"Reinterpretation of the cranial morphology of <em>Utatsusaurus hataii</em> (Ichthyopterygia) (Osawa Formation, Lower Triassic, Miyagi, Japan) and its systematic implications",2013,Journal of Vertebrate Paleontology,0.605,0.828,215,8,130,0.186,0.308,0.331,0.29,0.727,105,7,98,33,33.9,31.8,11.6,37.6,,,,,,
Fernandez_2007a.tnt,,,Ichthyopterygia,Ichthyopterygia,,,,,?,Sauropsida,Amniota,Tetrapoda,Sarcopterygii,Osteichthyes,Gnathostomata,Chordata,Animalia,Redescription and phylogenetic position of <em>Caypullisaurus</em> (Ichthyosauria: Ophthalmosauridae),2007,Journal of Paleontology,0.704,0.667,27,2,19,0.481,0.684,0.473,0.32,0.35,25,10,15,9,19.1,38.4,18.9,37,,,,,,
Fischer_etal_2011a.tnt,,,Ichthyopterygia,Ichthyopterygia,,,,,?,Sauropsida,Amniota,Tetrapoda,Sarcopterygii,Osteichthyes,Gnathostomata,Chordata,Animalia,A new Barremian (Early Cretaceous) ichthyosaur from western Russia,2011,Journal of Vertebrate Paleontology,0.541,0.634,98,2,53,0.133,0.245,0.57,0.342,0.376,50,1,49,15,31.1,28.4,10.3,32.5,,,,,,
Fischer_etal_2012a.tnt,,,Ichthyopterygia,Ichthyopterygia,,,,,?,Sauropsida,Amniota,Tetrapoda,Sarcopterygii,Osteichthyes,Gnathostomata,Chordata,Animalia,New ophthalmosaurid ichthyosaurs from the European Lower Cretaceous demonstrate extensive ichthyosaur survival across the Jurassic-Cretaceous boundary,2012,PLOS ONE,0.54,0.671,100,1,54,0.16,0.296,0.496,0.358,0.424,51,1,50,17,33.2,21.2,9.7,24,,,,,,
Fischer_etal_2013aa.tnt,,,Ichthyopterygia,Ichthyopterygia,,,,,?,Sauropsida,Amniota,Tetrapoda,Sarcopterygii,Osteichthyes,Gnathostomata,Chordata,Animalia,A basal thunnosaurian from Iraq reveals disparate phylogenetic origins for Cretaceous ichthyosaurs,2013,Biology Letters,0.511,0.767,137,1,70,0.204,0.4,0.404,0.393,0.594,66,1,65,26,37.6,20,6.9,23.1,,,,,,
Fischer_etal_2013ab.tnt,,,Ichthyopterygia,Ichthyopterygia,,,,,?,Sauropsida,Amniota,Tetrapoda,Sarcopterygii,Osteichthyes,Gnathostomata,Chordata,Animalia,A basal thunnosaurian from Iraq reveals disparate phylogenetic origins for Cretaceous ichthyosaurs,2013,Biology Letters,0.668,0.911,187,10,125,0.203,0.304,0.265,0.253,0.864,128,7,121,35,25.9,37.8,13,42.2,,,,,,
Fischer_etal_2013ac.tnt,,,Ichthyopterygia,Ichthyopterygia,,,,,?,Sauropsida,Amniota,Tetrapoda,Sarcopterygii,Osteichthyes,Gnathostomata,Chordata,Animalia,A basal thunnosaurian from Iraq reveals disparate phylogenetic origins for Cretaceous ichthyosaurs,2013,Biology Letters,0.602,0.841,231,6,139,0.19,0.316,0.339,0.304,0.749,105,0,105,34,34.1,42.1,14.5,48.8,,,,,,
Fischer_etal_2013ad.tnt,,,Ichthyopterygia,Ichthyopterygia,,,,,?,Sauropsida,Amniota,Tetrapoda,Sarcopterygii,Osteichthyes,Gnathostomata,Chordata,Animalia,A basal thunnosaurian from Iraq reveals disparate phylogenetic origins for Cretaceous ichthyosaurs,2013,Biology Letters,0.58,0.802,207,12,120,0.174,0.3,0.303,0.275,0.68,105,17,88,33,35.6,26.4,8.7,29.3,,,,,,
Frobisch_etal_inpressa.tnt,,,Ichthyopterygia,Ichthyopterygia,,,,,?,Sauropsida,Amniota,Tetrapoda,Sarcopterygii,Osteichthyes,Gnathostomata,Chordata,Animalia,Macropredatory ichthyosaur from the Middle Triassic and the origin of modern trophic networks,2013,"Proceedings of the National Academy of Sciences, USA",0.527,0.802,279,8,147,0.154,0.292,0.328,0.321,0.69,111,0,111,37,33.4,34.7,12.9,38.5,,,,,,
Ji_etal_2013a.tnt,,,Ichthyopterygia,Ichthyopterygia,,,,,?,Sauropsida,Amniota,Tetrapoda,Sarcopterygii,Osteichthyes,Gnathostomata,Chordata,Animalia,"A new juvenile specimen of <em>Guanlingsaurus</em> (Ichthyosauria, Shastasauridae) from the Upper Triassic of southwestern China",2013,Journal of Vertebrate Paleontology,0.578,0.83,237,32,137,0.16,0.277,0.338,0.273,0.732,109,1,108,33,33,41,16.3,47.4,,,,,,
