Bennett_1996a.tnt,,,Pterosauria,Pterosauria,,,Avemetatarsalia,Archosauromorpha,Diapsida,Sauropsida,Amniota,Tetrapoda,Sarcopterygii,Osteichthyes,Gnathostomata,Chordata,Animalia,The phylogenetic position of the Pterosauria within the Archosauromorpha,1996,Zoological Journal of the Linnean Society,0.663,0.786,193,2,128,0.197,0.297,0.372,0.223,0.693,126,15,111,14,12.2,56.9,46.2,58.1,,,,,,
Benton_1990a.tnt,Rhamphorhynchidae,,Pterosauria,Pterosauria,,,Avemetatarsalia,Archosauromorpha,Diapsida,Sauropsida,Amniota,Tetrapoda,Sarcopterygii,Osteichthyes,Gnathostomata,Chordata,Animalia,"The species of Rhynchosaurus, a rhynchosaur (Reptilia, Diapsida) from the Middle Triassic of England",1990,Philosophical Transactions of the Royal Society of London B,0.743,0.839,35,5448,26,0.029,0.038,0.516,0.369,0.693,26,3,23,17,33,11.7,7.6,12.2,,,,,,
Dalla_Vecchia_2009b.tnt,,,Pterosauria,Pterosauria,,,Avemetatarsalia,Archosauromorpha,Diapsida,Sauropsida,Amniota,Tetrapoda,Sarcopterygii,Osteichthyes,Gnathostomata,Chordata,Animalia,"Anatomy and systematics of the pterosaur Carniadactylus gen. n. rosenfeldi (Dalla Vecchia, 1995)",2009,Rivista Italiana di Paleontologia e Stratigrafia,0.538,0.729,197,10,106,0.112,0.208,0.366,0.263,0.585,73,0,73,27,22.8,35.6,16.5,38.6,,,,,,
Dalla_Vecchia_2009c.tnt,,,Pterosauria,Pterosauria,,,Avemetatarsalia,Archosauromorpha,Diapsida,Sauropsida,Amniota,Tetrapoda,Sarcopterygii,Osteichthyes,Gnathostomata,Chordata,Animalia,"The first Italian specimen of Austriadactylus cristatus (Diapsida, Pterosauria) from the Norian (Upper Triassic) of the Carnic Prealps",2009,Rivista Italiana di Paleontologia e Stratigrafia,0.544,0.734,195,4,106,0.174,0.321,0.362,0.255,0.594,73,0,73,26,19.9,39.4,18.4,43.6,,,,,,
Kellner_2003a.tnt,,,Pterosauria,Pterosauria,,,Avemetatarsalia,Archosauromorpha,Diapsida,Sauropsida,Amniota,Tetrapoda,Sarcopterygii,Osteichthyes,Gnathostomata,Chordata,Animalia,Pterosaur phylogeny and comments on the evolutionary history of the group,2003,Geological Society of London Special Publications,0.814,0.927,167,1,136,0.287,0.353,0.385,0.289,0.884,74,0,74,42,29.2,46.1,14.3,50.2,,,,,,
Lu_et_Ji_2006a.tnt,,,Pterosauria,Pterosauria,,,Avemetatarsalia,Archosauromorpha,Diapsida,Sauropsida,Amniota,Tetrapoda,Sarcopterygii,Osteichthyes,Gnathostomata,Chordata,Animalia,Preliminary results of a phylogenetic analysis of the pterosaurs from western Liaoning and surounding areas. ,2006,Journal of the Paleontological Society of Korea,0.447,0.779,264,1260,118,0.083,0.186,0.266,0.314,0.652,80,1,79,56,34,19.3,7.5,20.6,,,,,,
Lu_etal_2008a.tnt,,,Pterosauria,Pterosauria,,,Avemetatarsalia,Archosauromorpha,Diapsida,Sauropsida,Amniota,Tetrapoda,Sarcopterygii,Osteichthyes,Gnathostomata,Chordata,Animalia,A new azhdarchoid pterosaur from the Lower Cretaceous of China and its implications for pterosaur phylogeny and evolution,2008,Naturwissenschaften,0.593,0.839,145,243,86,0.29,0.488,0.309,0.269,0.742,73,1,72,32,21.4,43.4,20.7,45.7,,,,,,
Lu_etal_2010b.tnt,,,Pterosauria,Pterosauria,,,Avemetatarsalia,Archosauromorpha,Diapsida,Sauropsida,Amniota,Tetrapoda,Sarcopterygii,Osteichthyes,Gnathostomata,Chordata,Animalia,Evidence for modular evolution in a long-tailed pterosaur with a pterodactyloid skull,2010,Proceedings of the Royal Society of London B,0.436,0.798,374,8856,163,0.163,0.374,0.23,0.239,0.698,117,0,117,57,24.3,38,14.9,41.9,,,,,,
Lu_etal_2012a.tnt,,,Pterosauria,Pterosauria,,,Avemetatarsalia,Archosauromorpha,Diapsida,Sauropsida,Amniota,Tetrapoda,Sarcopterygii,Osteichthyes,Gnathostomata,Chordata,Animalia,"Largest toothed pterosaur skull from the Early Cretaceous Yixian Formation of western Liaoning, China, with comments on the family Boreopteridae",2012,Acta Geologica Sinica,0.406,0.786,401,1512,163,0.172,0.424,0.217,0.247,0.677,117,0,117,60,25,36.4,14.4,40,,,,,,
Naish_etal_2013aa.tnt,,,Pterosauria,Pterosauria,,,Avemetatarsalia,Archosauromorpha,Diapsida,Sauropsida,Amniota,Tetrapoda,Sarcopterygii,Osteichthyes,Gnathostomata,Chordata,Animalia,"A new small-bodied azhdarchoid pterosaur from the Lower Cretaceous of England and its implications for pterosaur anatomy, diversity and phylogeny",2013,PLOS One,0.4,0.636,60,927,24,0.083,0.208,0.415,0.473,0.198,23,1,22,24,26.6,7.7,4.7,7.8,Dimorphod,AMNH_2256,Anhanguer,Anhanguer,Anurognat,
Naish_etal_2013ab.tnt,,,Pterosauria,Pterosauria,,,Avemetatarsalia,Archosauromorpha,Diapsida,Sauropsida,Amniota,Tetrapoda,Sarcopterygii,Osteichthyes,Gnathostomata,Chordata,Animalia,"A new small-bodied azhdarchoid pterosaur from the Lower Cretaceous of England and its implications for pterosaur anatomy, diversity and phylogeny",2013,PLOS One,0.678,0.813,245,2,166,0.269,0.397,0.434,0.384,0.71,129,15,114,32,41.6,44.9,18.3,48.7,Ornithosu,Herrerasa,Scleromoc,Anurognat,Rhamphorh,Pterodact
Unwin_2003a.tnt,,,Pterosauria,Pterosauria,,,Avemetatarsalia,Archosauromorpha,Diapsida,Sauropsida,Amniota,Tetrapoda,Sarcopterygii,Osteichthyes,Gnathostomata,Chordata,Animalia,On the phylogeny and evolutionary history of pterosaurs,2003,Geological Society of London Special Publications,0.646,0.824,96,2,62,0.458,0.176,0.427,0.388,0.726,60,2,58,20,11.1,64.5,31.6,69.6,Outgroup,Preondact,Dimorphod,Anurognat,Campylogn,Scaphogna
Unwin_2003b.tnt,,,Pterosauria,Pterosauria,,,Avemetatarsalia,Archosauromorpha,Diapsida,Sauropsida,Amniota,Tetrapoda,Sarcopterygii,Osteichthyes,Gnathostomata,Chordata,Animalia,Eudimorphodon and the early history of pterosaurs,2003,"Rivista Museo civico Scienze Naturali ""E. Caffi"" Bergamo",0.789,0.899,71,1,56,0.493,0.274,0.507,0.436,0.84,53,1,52,16,12.9,67.3,34.6,72,Outgroup,Preondact,Dimorphod,Peteinosa,Anurognat,Batrachog
Witton_2012a,,,Pterosauria,Pterosauria,,,Avemetatarsalia,Archosauromorpha,Diapsida,Sauropsida,Amniota,Tetrapoda,Sarcopterygii,Osteichthyes,Gnathostomata,Chordata,Animalia,"New insights into the skull of Istiodactylus latidens (Ornithocheiroidea, Pterodactyloidea)",2012,PLoS ONE,0.725,0.72,51,20,37,0.059,0.081,0.616,0.374,0.498,74,41,33,10,31.6,42.9,19,40.2,,,,,,
Apesteguia_et_Novas_2003a.tnt,,,Rhynchocephalia,Lepidosauriformes,,,,,Diapsida,Sauropsida,Amniota,Tetrapoda,Sarcopterygii,Osteichthyes,Gnathostomata,Chordata,Animalia,Large Cretaceous sphenodontian from Patagonia provides insight into lepidosaur evolution in Gondwana,2003,Nature,0.605,0.664,119,2,72,0.244,0.403,0.458,0.286,0.441,67,14,53,16,31.3,40,19.3,39.9,,,,,,
Apesteguia_etal_2012a.tnt,,,Rhynchocephalia,Lepidosauriformes,,,,,Diapsida,Sauropsida,Amniota,Tetrapoda,Sarcopterygii,Osteichthyes,Gnathostomata,Chordata,Animalia,A basal sphenodontian (Lepidosauria) from the Jurassic of Patagonia: new insights on the phylogeny and biogeography of Gondwanan rhynchocephalians,2012,Zoological Journal of the Linnean Society,0.52,0.706,179,24,93,0.112,0.215,0.419,0.332,0.513,73,7,66,26,40.5,30.2,10.8,29.7,,,,,,
Arantes_etal_2009a.tnt,,,Rhynchocephalia,Lepidosauriformes,,,,,Diapsida,Sauropsida,Amniota,Tetrapoda,Sarcopterygii,Osteichthyes,Gnathostomata,Chordata,Animalia,"<em>Clevosaurus brasiliensis</em> (Lepidosauria, Sphenodontia) do Triassico Superior do Rio Grande do Sul: anatomica pos-craniana e relacoes filogeneticas",2009,Revista Brasileira de Paleontologia,0.578,0.684,128,4,74,0.156,0.27,0.467,0.322,0.463,67,12,55,18,31.4,35.4,17.8,36,,,,,,
Fraser_et_Benton_1989a.tnt,,,Rhynchocephalia,Lepidosauriformes,,,,,Diapsida,Sauropsida,Amniota,Tetrapoda,Sarcopterygii,Osteichthyes,Gnathostomata,Chordata,Animalia,The Triassic reptiles <em>Brachyrhinodon</em> and <em>Polysphenodon</em> and the relationships of the sphenodontids,1989,Zoological Journal of the Linnean Society,0.84,0.922,25,22,21,0.52,0.619,0.477,0.28,0.846,29,8,21,15,21.4,46.9,14.4,44.1,,,,,,
Rauhut_etal_2012a.tnt,,,Rhynchocephalia,Lepidosauriformes,,,,,Diapsida,Sauropsida,Amniota,Tetrapoda,Sarcopterygii,Osteichthyes,Gnathostomata,Chordata,Animalia,A new rhynchocephalian from the Late Jurassic of Germany with a dentition that is unique amongst tetrapods,2012,PLOS One,0.465,0.649,187,93,87,0.107,0.247,0.427,0.414,0.438,70,0,70,22,29.7,38.6,16.4,42.4,Younginia,Squamata ,Gephyrosa,Brachyrhi,Clevosaur,Clevosaur
Reynoso_1996a.tnt,,,Rhynchocephalia,Lepidosauriformes,,,,,Diapsida,Sauropsida,Amniota,Tetrapoda,Sarcopterygii,Osteichthyes,Gnathostomata,Chordata,Animalia,"A Middle Jurassic <em>Sphenodon</em>-like sphenodontian (Diapsida: Lepidosauria) from Huizachal Canyon, Tamaulipas, Mexico",1996,Journal of Vertebrate Paleontology,0.69,0.798,71,1,49,0.324,0.589,0.531,0.482,0.675,42,1,41,16,18.8,50.7,23.1,54.4,Youngina,Squamata ,Gephyrosa,Diphydont,Planoceph,Palaeople
Reynoso_1997a.tnt,,,Rhynchocephalia,Lepidosauriformes,,,,,Diapsida,Sauropsida,Amniota,Tetrapoda,Sarcopterygii,Osteichthyes,Gnathostomata,Chordata,Animalia,A &quot;beaded&quot; sphenodontian (Diapsida: Lepidosauria) from the Early Cretaceous of Central Mexico,1997,Journal of Vertebrate Paleontology,0.644,0.804,87,1,56,0.379,0.5,0.431,0.393,0.686,48,1,47,20,19.3,49.4,19.5,52.3,Youngina,Squamata ,Gephyrosa,Diphydont,Planoceph,Palaeople
Reynoso_et_Clark_1998a.tnt,,,Rhynchocephalia,Lepidosauriformes,,,,,Diapsida,Sauropsida,Amniota,Tetrapoda,Sarcopterygii,Osteichthyes,Gnathostomata,Chordata,Animalia,"A dwarf sphenodontian from the Jurassic La Boca Formation of Tamaulipas, Mexico",1998,Journal of Vertebrate Paleontology,0.55,0.751,109,1,60,0.275,0.4,0.395,0.4,0.592,52,1,51,22,22.1,36.3,16.3,39.1,Youngina,Squamata ,Gephyrosa,Diphydont,Planoceph,Palaeople
Sues_etal_1994a.tnt,,,Rhynchocephalia,Lepidosauriformes,,,,,Diapsida,Sauropsida,Amniota,Tetrapoda,Sarcopterygii,Osteichthyes,Gnathostomata,Chordata,Animalia,"A new sphenodontian (Lepidosauria: Rhynchocephalia) from the McCoy Brook Formation (Lower Jurassic) of Nova Scotia, Canada",1994,Journal of Vertebrate Paleontology,0.66,0.784,47,1,31,0.404,0.334,0.451,0.407,0.64,34,5,29,14,5.5,39.7,21.3,44.4,outgroup,Gephyrosa,Diphydont,Planoceph,Polyspeno,Brachyrhi
Wilkinson_et_Benton_1996a,,,Rhynchocephalia,Lepidosauriformes,,,,,Diapsida,Sauropsida,Amniota,Tetrapoda,Sarcopterygii,Osteichthyes,Gnathostomata,Chordata,Animalia,Sphenodontid phylogeny and the problems of multiple trees,1996,Philosophical Transactions of the Royal Society of London B,0.84,0.922,25,22,21,0.52,0.619,0.477,0.463,0.846,29,8,21,15,21.4,46.9,14.4,44.1,,,,,,
Wu_1994a,,,Rhynchocephalia,Lepidosauriformes,,,,,Diapsida,Sauropsida,Amniota,Tetrapoda,Sarcopterygii,Osteichthyes,Gnathostomata,Chordata,Animalia,Late Triassic-Early Jurassic sphenodontians from China and the phylogeny of the Sphenodontia,1994,In the Shadow of the Dinosaurs,0.673,0.789,49,1,33,0.347,0.516,0.481,0.417,0.65,36,4,32,12,7.2,49.6,27.6,52,,,,,,
Ahlberg_1991a.tnt,Porolepiformes,,Sarcopterygii,Sarcoperygii_minus_Tetrapoda,,,,,,,,,Sarcopterygii,Osteichthyes,Gnathostomata,Chordata,Animalia,"A re-examination of sarcopterygian interrelationships, with special reference to the Porolepiformes",1991,Zoological Journal of the Linnean Society,0.6,0.621,90,3,54,0.167,0.278,0.544,0.301,0.375,54,2,52,12,29.2,43.2,22.8,46.9,,,,,,
Ahlberg_et_Johanson_1997aa.tnt,Osteolepiformes,,Sarcopterygii,Sarcoperygii_minus_Tetrapoda,,,,,,,,,Sarcopterygii,Osteichthyes,Gnathostomata,Chordata,Animalia,"Second tristichopterid (Sarcopterygii, Osteolepiformes) from the Upper Devonian of Canowindra, New South Wales, Australia, and phylogeny of the Tristichopteridae",1997,Journal of Vertebrate Paleontology,0.933,0.96,15,1,14,0.6,0.643,0.595,0.488,0.918,14,1,13,8,12.5,83.5,41.8,78.6,,,,,,
Ahlberg_et_Johanson_1997ab.tnt,Osteolepiformes,,Sarcopterygii,Sarcoperygii_minus_Tetrapoda,,,,,,,,,Sarcopterygii,Osteichthyes,Gnathostomata,Chordata,Animalia,"Second tristichopterid (Sarcopterygii, Osteolepiformes) from the Upper Devonian of Canowindra, New South Wales, Australia, and phylogeny of the Tristichopteridae",1997,Journal of Vertebrate Paleontology,0.778,0.826,18,1,14,0.222,0.286,0.607,0.488,0.629,14,1,13,8,16.1,38.4,21.8,39.4,,,,,,
Ahlberg_et_Johanson_1997ac.tnt,Osteolepiformes,,Sarcopterygii,Sarcoperygii_minus_Tetrapoda,,,,,,,,,Sarcopterygii,Osteichthyes,Gnathostomata,Chordata,Animalia,"Second tristichopterid (Sarcopterygii, Osteolepiformes) from the Upper Devonian of Canowindra, New South Wales, Australia, and phylogeny of the Tristichopteridae",1997,Journal of Vertebrate Paleontology,0.778,0.833,18,1,14,0.333,0.428,0.833,0.405,0.648,14,1,13,8,15.2,51.4,25.3,48.6,,,,,,
Ahlberg_et_Johanson_1998a.tnt,Osteolepiformes,,Sarcopterygii,Sarcoperygii_minus_Tetrapoda,,,,,,,,,Sarcopterygii,Osteichthyes,Gnathostomata,Chordata,Animalia,Osteolepiforms and the ancestry of tetrapods,1998,Nature,0.553,0.772,188,3,104,0.42,0.76,0.383,0.258,0.643,99,8,91,29,29.6,44.9,20.5,48.5,,,,,,
Ahlberg_etal_2006a.tnt,Dipnoi,,Sarcopterygii,Sarcoperygii_minus_Tetrapoda,,,,,,,,,Sarcopterygii,Osteichthyes,Gnathostomata,Chordata,Animalia,Developmental plasticity and disparity in early dipnoan (lungfish) dentitions,2006,Evolution &amp; Development,0.45,0.713,231,7,104,0.117,0.26,0.347,0.332,0.533,79,0,79,33,33.1,26.2,10.6,29.5,,,,,,
Brazeau_2005aa.tnt,Tetrapodomorpha,,Sarcopterygii,Sarcoperygii_minus_Tetrapoda,,,,,,,,,Sarcopterygii,Osteichthyes,Gnathostomata,Chordata,Animalia,"A new genus of rhizodontid (Sarcopterygii, Tetrapodomorpha) from the Lower Carboniferous Horton Bluff Formation of Nova Scotia, and the evolution of the lower jaws in this group",2005,Canadian Journal of Earth Sciences,0.711,0.8,45,3,32,0.244,0.344,0.567,0.409,0.624,24,2,22,15,17.8,37.9,14.2,40.6,,,,,,
Brazeau_2005ab.tnt,Tetrapodomorpha,,Sarcopterygii,Sarcoperygii_minus_Tetrapoda,,,,,,,,,Sarcopterygii,Osteichthyes,Gnathostomata,Chordata,Animalia,"A new genus of rhizodontid (Sarcopterygii, Tetrapodomorpha) from the Lower Carboniferous Horton Bluff Formation of Nova Scotia, and the evolution of the lower jaws in this group",2005,Canadian Journal of Earth Sciences,0.714,0.806,42,3,30,0.214,0.3,0.461,0.367,0.636,24,2,22,14,19,42.5,16.1,44.8,,,,,,
Cavin_etal_2007a.tnt,Dipnoi,,Sarcopterygii,Sarcoperygii_minus_Tetrapoda,,,,,,,,,Sarcopterygii,Osteichthyes,Gnathostomata,Chordata,Animalia,"A new Thai Mesozoic lungfish (Sarcopterygii, Dipnoi) with an insight into post-Palaeozoic dipnoan evolution",2007,Zoological Journal of the Linnean Society,0.731,0.825,26,3,19,0.385,0.526,0.488,0.454,0.587,14,2,12,16,22.3,25.7,10.7,27.1,,,,,,
Chang_2004a.tnt,Dipnoi,,Sarcopterygii,Sarcoperygii_minus_Tetrapoda,,,,,,,,,Sarcopterygii,Osteichthyes,Gnathostomata,Chordata,Animalia,Synapomorphies and scenarios - more characters of Youngolepis betraying its affinity to the Dipnoi,2004,Recent Advances in the Origin and Early Radiation of Vertebrates,0.591,0.666,235,4,139,0.191,0.324,0.395,0.213,0.516,155,32,123,14,19.4,70.6,44.3,70.3,,,,,,
Clement_2005a.tnt,Actinistia,,Sarcopterygii,Sarcoperygii_minus_Tetrapoda,,,,,,,,,Sarcopterygii,Osteichthyes,Gnathostomata,Chordata,Animalia,"A new coelacanth (Actinistia, Sarcopterygii) from the Jurassic of France, and the question of the closest relative fossil to Latimeria",2005,Journal of Vertebrate Paleontology,0.461,0.698,230,5,106,0.157,0.34,0.326,0.282,0.53,108,7,101,26,26.5,37.5,16.9,39.8,,,,,,
Cloutier_1991a.tnt,Actinistia,,Sarcopterygii,Sarcoperygii_minus_Tetrapoda,,,,,,,,,Sarcopterygii,Osteichthyes,Gnathostomata,Chordata,Animalia,"Patterns, trends, and rates of evolution within the Actinistia",1991,Environmental Biology of Fishes,0.361,0.597,255,90,92,0.082,0.228,0.317,0.291,0.325,75,6,69,32,25.4,19.2,7.7,21,,,,,,
Cloutier_et_Ahlberg_1996a.tnt,Actinistia,,Sarcopterygii,Sarcoperygii_minus_Tetrapoda,,,,,,,,,Sarcopterygii,Osteichthyes,Gnathostomata,Chordata,Animalia,"Morphology, characters, and the interrelationships of basal sarcopterygians",1996,Interrelationships of Fishes,0.571,0.826,275,6,157,0.393,0.688,0.368,0.241,0.741,140,1,139,34,30.5,62.6,29.6,69.4,,,,,,
Dutel_etal_2012aa.tnt,Actinistia,,Sarcopterygii,Sarcoperygii_minus_Tetrapoda,,,,,,,,,Sarcopterygii,Osteichthyes,Gnathostomata,Chordata,Animalia,"The giant Cretaceous coelacanth (Actinistia, Sarcopterygii) Megalocoelacanthus dobiei Schwimmer, Stewart &amp; Williams, 1994, and its bearing on Latimerioidei interrelationships",2012,PLoS One,0.413,0.694,288,24,119,0.097,0.235,0.336,0.296,0.509,110,0,110,39,39.5,16,6.6,18.7,,,,,,
Dutel_etal_2012ab.tnt,Actinistia,,Sarcopterygii,Sarcoperygii_minus_Tetrapoda,,,,,,,,,Sarcopterygii,Osteichthyes,Gnathostomata,Chordata,Animalia,"The giant Cretaceous coelacanth (Actinistia, Sarcopterygii) Megalocoelacanthus dobiei Schwimmer, Stewart &amp; Williams, 1994, and its bearing on Latimerioidei interrelationships",2012,PLoS One,0.415,0.693,287,2,119,0.136,0.327,0.317,0.302,0.512,110,0,110,37,37,21.2,8,24.6,,,,,,
Forey_1991a.tnt,Actinistia,,Sarcopterygii,Sarcoperygii_minus_Tetrapoda,,,,,,,,,Sarcopterygii,Osteichthyes,Gnathostomata,Chordata,Animalia,Latimeria chalumnae and its pedigree,1991,Environmental Biology of Fishes,0.514,0.803,111,71,57,0.207,0.403,0.392,0.343,0.64,56,0,56,33,29.4,24.7,7.2,30.4,,,,,,
Forey_1998aa.tnt,Actinistia,,Sarcopterygii,Sarcoperygii_minus_Tetrapoda,,,,,,,,,Sarcopterygii,Osteichthyes,Gnathostomata,Chordata,Animalia,History of the Coelacanth Fishes,1998,History of the Coelacanth Fishes,0.45,0.706,251,26,113,0.088,0.195,0.352,0.285,0.532,108,0,108,32,36,22.6,8,25.4,,,,,,
Forey_1998ab.tnt,Actinistia,,Sarcopterygii,Sarcoperygii_minus_Tetrapoda,,,,,,,,,Sarcopterygii,Osteichthyes,Gnathostomata,Chordata,Animalia,History of the Coelacanth Fishes,1998,History of the Coelacanth Fishes,0.496,0.711,226,28,112,0.186,0.375,0.38,0.278,0.564,108,6,102,23,26.9,36.6,22.1,37.9,,,,,,
Friedman_2007b.tnt,Actinistia,,Sarcopterygii,Sarcoperygii_minus_Tetrapoda,,,,,,,,,Sarcopterygii,Osteichthyes,Gnathostomata,Chordata,Animalia,<em>Styloichthys</em> as the oldest coelacanth: implications for early osteichthyan interrelationships,2007,Journal of Systematic Palaeontology,0.446,0.7,502,15,224,0.177,0.398,0.318,0.261,0.561,195,0,195,39,44.5,39.7,18.3,45,,,,,,
Friedman_et_Coates_2006a.tnt,Actinistia,,Sarcopterygii,Sarcoperygii_minus_Tetrapoda,,,,,,,,,Sarcopterygii,Osteichthyes,Gnathostomata,Chordata,Animalia,A newly recognized fossil coelacanth highlights the early morphological diversification of the clade,2006,Proceedings of the Royal Society of London B,0.459,0.703,242,32,111,0.099,0.216,0.356,0.285,0.539,109,3,106,27,27.5,37,15.6,38.2,,,,,,
Geng_etal_2009a.tnt,Actinistia,,Sarcopterygii,Sarcoperygii_minus_Tetrapoda,,,,,,,,,Sarcopterygii,Osteichthyes,Gnathostomata,Chordata,Animalia,"A revision and phylogenetic analysis of <em>Guizhoucoelacanthus</em> (Sarcopterygii, Actinistia) from the Triassic of China",2009,Vertebrata PalAsiatica,0.429,0.69,259,154,111,0.089,0.207,0.325,0.298,0.516,109,3,106,30,29.7,32.8,13,35.2,,,,,,
Graf_2012a.tnt,Actinistia,,Sarcopterygii,Sarcoperygii_minus_Tetrapoda,,,,,,,,,Sarcopterygii,Osteichthyes,Gnathostomata,Chordata,Animalia,A new Early Cretaceous coelacanth from Texas,2012,Historical Biology,0.447,0.716,255,132,114,0.063,0.14,0.337,0.299,0.545,109,0,109,35,38.8,22.6,7.4,25.6,,,,,,
Johanson_2004aa.tnt,,,Sarcopterygii,Sarcoperygii_minus_Tetrapoda,,,,,,,,,Sarcopterygii,Osteichthyes,Gnathostomata,Chordata,Animalia,Late Devonian sarcopterygian fishes from eastern Gondwana (Australia and Antarctica) and their importance in phylogeny and biogeography,2004,Recent Advances in the Origin and Early Radiation of Vertebrates,0.538,0.765,195,3,105,0.39,0.724,0.377,0.259,0.626,99,7,92,30,30.6,38.8,18.2,42.6,,,,,,
Johanson_2004ab.tnt,,,Sarcopterygii,Sarcoperygii_minus_Tetrapoda,,,,,,,,,Sarcopterygii,Osteichthyes,Gnathostomata,Chordata,Animalia,Late Devonian sarcopterygian fishes from eastern Gondwana (Australia and Antarctica) and their importance in phylogeny and biogeography,2004,Recent Advances in the Origin and Early Radiation of Vertebrates,0.763,0.816,38,2,29,0.237,0.31,0.61,0.346,0.659,31,5,26,10,27.7,49,28.7,49.5,,,,,,
Johanson_et_Ahlberg_1998a.tnt,,,Sarcopterygii,Sarcoperygii_minus_Tetrapoda,,,,,,,,,Sarcopterygii,Osteichthyes,Gnathostomata,Chordata,Animalia,A complete primitive rhizodont from Australia,1998,Nature,0.816,0.848,38,3,31,0.184,0.226,0.655,0.443,0.706,29,2,27,10,29,37.7,19.7,40.5,,,,,,
Johanson_et_Ahlberg_2001aa.tnt,,,Sarcopterygii,Sarcoperygii_minus_Tetrapoda,,,,,,,,,Sarcopterygii,Osteichthyes,Gnathostomata,Chordata,Animalia,Devonian rhizodontids and tristichopterids (Sarcopterygii; Tetrapodomorpha) from East Gondwana,2001,Transactions of the Royal Society of Edinburgh: Earth Sciences,0.553,0.775,190,3,105,0.4,0.723,0.34,0.243,0.642,99,7,92,30,30.9,40.8,18.5,44.5,,,,,,
Johanson_et_Ahlberg_2001ab.tnt,,,Sarcopterygii,Sarcoperygii_minus_Tetrapoda,,,,,,,,,Sarcopterygii,Osteichthyes,Gnathostomata,Chordata,Animalia,Devonian rhizodontids and tristichopterids (Sarcopterygii; Tetrapodomorpha) from East Gondwana,2001,Transactions of the Royal Society of Edinburgh: Earth Sciences,0.781,0.825,32,2,25,0.281,0.36,0.503,0.414,0.652,27,6,21,10,32.6,47.3,21.8,48.7,,,,,,
Krupina_et_Reisz_2000a.tnt,Dipnoi,,Sarcopterygii,Sarcoperygii_minus_Tetrapoda,,,,,,,,,Sarcopterygii,Osteichthyes,Gnathostomata,Chordata,Animalia,"Phylogeny of Devonian dipnoans, with special emphasis on forms from the Russian Platform",2000,Paleontological Journal,0.551,0.592,118,1,65,0.127,0.231,0.438,0.341,0.314,48,4,44,14,23.5,32.1,15.3,36.2,,,,,,
Lloyd_etal_2012a.tnt,Dipnoi,,Sarcopterygii,Sarcoperygii_minus_Tetrapoda,,,,,,,,,Sarcopterygii,Osteichthyes,Gnathostomata,Chordata,Animalia,Identifying heterogeneity in rates of morphological evolution: discrete character change in the evolution of lungfish (Sarcopterygii; Dipnoi),2012,Evolution,0.291,0.683,628,100000,183,0,0,0.195,0.318,0.499,91,1,90,86,44.3,8.6,4.2,9.7,,,,,,
Marshall_1986a.tnt,Dipnoi,,Sarcopterygii,Sarcoperygii_minus_Tetrapoda,,,,,,,,,Sarcopterygii,Osteichthyes,Gnathostomata,Chordata,Animalia,Lungfish: phylogeny and parsimony,1986,Journal of Morphology,0.773,0.936,22,48,17,0.5,0.647,0.322,0.3,0.85,23,6,17,24,0,25.9,13.6,26.5,,,,,,
Schultze_1994a.tnt,,,Sarcopterygii,Sarcoperygii_minus_Tetrapoda,,,,,,,,,Sarcopterygii,Osteichthyes,Gnathostomata,Chordata,Animalia,Comparison of hypotheses on the relationships of sarcopterygians,1994,Systematic Biology,0.606,0.513,193,1,117,0.187,0,0.18,0.204,0.29,216,107,109,8,20.1,73.5,54,73.5,Actinopte,Tetrapoda,Panderich,Osteolepi,Porolepif,Diabolepi
Schultze_2001a.tnt,Dipnoi,,Sarcopterygii,Sarcoperygii_minus_Tetrapoda,,,,,,,,,Sarcopterygii,Osteichthyes,Gnathostomata,Chordata,Animalia,"Melanognathus, a primitive dipnoan from the Lower Devonian of the Canadian Arctic and the interrelationships of Devonian dipnoans",2001,Journal of Vertebrate Paleontology,0.324,0.627,364,46536,118,0.036,0.187,0.6,0.378,0.363,90,11,79,55,46.9,8.1,3.4,9,Psarolepi,Diabolepi,Adalolopa,Adelargo ,Andreyevi,Archaeone
Schultze_2004a.tnt,,,Sarcopterygii,Sarcoperygii_minus_Tetrapoda,,,,,,,,,Sarcopterygii,Osteichthyes,Gnathostomata,Chordata,Animalia,Mesozoic sarcopterygians,2004,"Mesozoic Fishes 3 - Systematics, Paleoenvironments and Biodiversity",0.639,0.688,119,51096,76,0,0.045,0.428,0.379,0.465,56,18,38,21,39.3,15.6,9.2,16.1,Conchopom,Aphelodus,Archaeoce,Arganodus,Ariguna  ,Asiatocer
Schultze_et_Chorn_1997a.tnt,Dipnoi,,Sarcopterygii,Sarcoperygii_minus_Tetrapoda,,,,,,,,,Sarcopterygii,Osteichthyes,Gnathostomata,Chordata,Animalia,The Permo-Carboniferous genus Sagenodus and the beginning of modern lungfish,1997,Contributions to Zoology,0.557,0.651,115,3,64,0.104,0.078,0.479,0.477,0.411,47,5,42,18,20.7,20.1,10.1,21.3,Dipterus,Rhinodipt,Scaumenac,Phaneropl,Conchopom,Delatitia
Schultze_et_Marshall_1993a.tnt,Dipnoi,,Sarcopterygii,Sarcoperygii_minus_Tetrapoda,,,,,,,,,Sarcopterygii,Osteichthyes,Gnathostomata,Chordata,Animalia,Contrasting the use of functional complexes and isolated characters in lungfish evolution,1993,Memoirs of the Association of Australasian Palaeontologists,0.41,0.736,429,100000,176,0.019,0.175,0.253,0.292,0.585,90,2,88,61,39.3,12.4,5.9,14.3,Diabolepi,Uranoloph,Speonesyd,Speonesyd,Dipnorhyn,Dipnorhyn
Wen_etal_2013a,Actinistia,,Sarcopterygii,Sarcoperygii_minus_Tetrapoda,,,,,,,,,Sarcopterygii,Osteichthyes,Gnathostomata,Chordata,Animalia,"Coelacanths from the Middle Triassic Luoping Biota, Yunnan, South China, with the earliest evidence of ovoviviparity",2013,Acta Palaeontologica Polonica,0.407,0.676,275,320,112,0.193,0.474,0.307,0.28,0.493,109,3,106,32,30.5,29.6,11.6,31.6,,,,,,
Wendruff_et_Wilson_2012a,Actinistia,,Sarcopterygii,Sarcoperygii_minus_Tetrapoda,,,,,,,,,Sarcopterygii,Osteichthyes,Gnathostomata,Chordata,Animalia,"A fork-tailed coelacanth, <em>Rebellatrix divaricerca</em>, gen. et sp. nov. (Actinistia, Rebellatricidae, fam. nov.), from the Lower Triassic of Western Canada",2012,Journal of Vertebrate Paleontology,0.419,0.671,260,37,109,0.081,0.193,0.34,0.338,0.484,109,6,103,29,30.7,27.8,11.9,30.5,,,,,,
Yabumoto_2008a,Actinistia,,Sarcopterygii,Sarcoperygii_minus_Tetrapoda,,,,,,,,,Sarcopterygii,Osteichthyes,Gnathostomata,Chordata,Animalia,"A new Mesozoic coelacanth from Brazil (Sarcopterygii, Actinistia)",2008,Paleontological Research,0.451,0.701,235,5,106,0.157,0.349,0.331,0.309,0.533,108,7,101,27,27,36.1,16.2,38.6,,,,,,
Zhu_et_Schultze_1997a,,,Sarcopterygii,Sarcoperygii_minus_Tetrapoda,,,,,,,,,Sarcopterygii,Osteichthyes,Gnathostomata,Chordata,Animalia,The oldest sarcopterygian fish,1997,Lethaia,0.571,0.82,273,6,156,0.278,0.488,0.304,0.261,0.731,140,2,138,33,31,57.4,29,61,,,,,,
Zhu_et_Yu_2002a,,,Sarcopterygii,Sarcoperygii_minus_Tetrapoda,,,,,,,,,Sarcopterygii,Osteichthyes,Gnathostomata,Chordata,Animalia,A primitive fish close to the common ancestor of tetrapods and lungfish,2002,Nature,0.549,0.759,328,8,180,0.186,0.339,0.362,0.289,0.65,158,0,158,27,32.4,54.3,27.4,58.5,,,,,,
Zhu_etal_2001a,,,Sarcopterygii,Sarcoperygii_minus_Tetrapoda,,,,,,,,,Sarcopterygii,Osteichthyes,Gnathostomata,Chordata,Animalia,A primitive sarcopterygian fish with an eyestalk,2001,Nature,0.568,0.765,317,3,180,0.24,0.422,0.357,0.266,0.659,158,0,158,26,32.9,55,26.7,60.1,,,,,,
