File / Data,Focal Group,,Grouping_for_statistical_tests,Grouping_tests_MW,,,,,,,,,,,Infraphylum,Phylum,Kingdom,Paper Title,Year Published,Journal/Book,CI,RI,L,#mpts,MinL,TSI,PSI,meanci,meanri,MHER,originalchars,uninformativechars,informativechars,Taxa,%missingchars,Average GC standard bootstrap support,average jackknife support,Average symmetric resampling support,1st taxon in matrix (1st 10 chars),2nd taxon,3rd taxon,4th,5th,6th
Adrain_1998a.tnt,Trilobita,,Arthropoda,Ecdysozoa,,,,,,,,,,,,Arthropoda,Animalia,"Systematics of the Acanthoparyphinae (Trilobita), with species from the Silurian of Arctic Canada",1998,Journal of Paleontology,0.581,0.834,86,4,50,0.558,0.961,0.318,0.297,0.724,39,0,39,24,5.9,41.3,16.5,45.1,,,,,,
Adrain_et_Edgecombe_1997a.tnt,Trilobita,,Arthropoda,Ecdysozoa,,,,,,,,,,,,Arthropoda,Animalia,Silurian encrinurine trilobites from the central Canadian Arctic,1997,Palaeontographica Canadiana,0.431,0.641,130,5,56,0.338,0.785,0.384,0.316,0.395,40,0,40,32,8.3,26.3,10.3,29.5,,,,,,
Adrain_et_Ramskold_1997a.tnt,Trilobita,,Arthropoda,Ecdysozoa,,,,,,,,,,,,Arthropoda,Animalia,"Silurian Odontopleurinae (Trilobita) from the Cape Phillips Formation, Arctic Canada",1997,Journal of Paleontology,0.9,0.951,20,1,18,0.6,0.667,0.429,0.426,0.895,17,2,15,10,2.4,60.8,34.9,62.5,,,,,,
Adrain_etal_2001a.tnt,Trilobita,,Arthropoda,Ecdysozoa,,,,,,,,,,,,Arthropoda,Animalia,"Systematics of the Ordovician trilobites <em>Ischyrotoma</em> and <em>Dimeropygiella</em>, with species from the type Ibexian Area, western U.S.A.",2001,Journal of Paleontology,0.636,0.808,55,5,35,0.273,0.429,0.395,0.371,0.655,25,0,25,18,12.4,47,17.2,50.9,,,,,,
Amati_et_Westrop_2004a.tnt,Trilobita,,Arthropoda,Ecdysozoa,,,,,,,,,,,,Arthropoda,Animalia,A systematic revision of <em>Thaleops</em> (Trilobita: Illaenidae) with new species from the middle and late Ordovician of Oklahoma and New York,2004,Journal of Systematic Palaeontology,0.571,0.766,70,4,40,0.3,0.525,0.428,0.388,0.563,20,0,20,28,7.1,22.9,6,27.9,,,,,,
Amati_etal_2004a.tnt,Decapoda,,Arthropoda,Ecdysozoa,,,,,,,,,,,,Arthropoda,Animalia,A new family of Triassic lobsters (Decapoda: Astacida) from British Columbia and its phylogenetic context,2004,Journal of Paleontology,0.559,0.781,68,1456,38,0.074,0.132,0.356,0.349,0.594,21,1,20,31,2.9,21.8,6.8,24.7,,,,,,
Bentley_et_Jago_2004a.tnt,Trilobita,,Arthropoda,Ecdysozoa,,,,,,,,,,,,Arthropoda,Animalia,Wuaniid trilobites of Australia,2004,Memoirs of the Association of Australasian Palaeontologists,0.266,0.594,94,2429,25,0.011,0.04,0.259,0.471,0.106,14,0,14,38,3.8,5.8,3,7,,,,,,
Caron_etal_2004a.tnt,Nektaspida,,Arthropoda,Ecdysozoa,,,,,,,,,,,,Arthropoda,Animalia,"A new Late Silurian (Pridolian) naraoiid (Euarthropoda: Nektaspida) from the Bertie Formation of southern Ontario, Canada: delayed fallout from the Cambrian Explosion",2004,Journal of Paleontology,0.786,0.85,14,1,11,0.643,0.818,0.792,0.368,0.687,12,1,11,11,6.1,60.5,23.4,59.4,,,,,,
Chatterton_1994aa.tnt,Trilobita,,Arthropoda,Ecdysozoa,,,,,,,,,,,,Arthropoda,Animalia,"Ordovician proetide trilobite <em>Dimeropyge</em>, with a new species from northwestern Canada",1994,Journal of Paleontology,0.578,0.732,45,1,26,0.333,0.577,0.492,0.274,0.518,21,0,21,14,1,35.9,15.1,40.9,,,,,,
Chatterton_1994ab.tnt,Trilobita,,Arthropoda,Ecdysozoa,,,,,,,,,,,,Arthropoda,Animalia,"Ordovician proetide trilobite <em>Dimeropyge</em>, with a new species from northwestern Canada",1994,Journal of Paleontology,0.578,0.721,45,1,26,0.333,0.577,0.535,0.307,0.504,21,0,21,14,1,35.7,14.6,40.9,,,,,,
Cronier_2003a.tnt,Trilobita,,Arthropoda,Ecdysozoa,,,,,,,,,,,,Arthropoda,Animalia,"Systematic relationships of the blind phacopine trilobite <em>Trimerocephalus</em>, with a new species from Causses_et_Veyran, Montagne Noire",2003,Acta Palaeontologica Polonica,0.69,0.719,29,3,20,0.379,0.55,0.355,0.207,0.35,23,11,12,14,4.3,22.7,12.7,21.8,,,,,,
Dunlop_et_Selden_1997a.tnt,Chelicerata,,Arthropoda,Ecdysozoa,,,,,,,,,,,,Arthropoda,Animalia,The early history and phylogeny of the chelicerates,1997,Arthropod Relationships,0.784,0.86,37,87,29,0.162,0.207,0.455,0.377,0.685,25,8,17,18,28,27.1,10.3,27.9,,,,,,
Ebach_et_Ahyong_2001a.tnt,Trilobita,,Arthropoda,Ecdysozoa,,,,,,,,,,,,Arthropoda,Animalia,Phylogeny of the trilobite subgenus <em>Acanthopyge (Lobopyge)</em>,2001,Cladistics,0.377,0.616,61,12,23,0.344,0.913,0.409,0.499,0.1,15,0,15,25,12,10.7,5.1,12.3,,,,,,
Ebbestad_et_Budd_2002a.tnt,Trilobita,,Arthropoda,Ecdysozoa,,,,,,,,,,,,Arthropoda,Animalia,"Burlingiid trilobites from Norway, with a discussion of their affinities and relationships",2002,Palaeontology,0.412,0.732,51,2875,21,0.098,0.238,0.315,0.448,0.457,22,1,21,21,12.8,19.9,8.8,21,,,,,,
Edgecombe_et_Ramskold_1999a.tnt,Trilobita,,Arthropoda,Ecdysozoa,,,,,,,,,,,,Arthropoda,Animalia,Relationships of Cambrian Arachnata and the systematic position of Trilobita,1999,Journal of Paleontology,0.745,0.797,55,10,41,0.491,0.659,0.719,0.33,0.648,29,0,29,19,17.2,47.6,20.6,50.4,,,,,,
Karasawa_et_Kato_2003a.tnt,Crustacea,,Arthropoda,Ecdysozoa,,,,,,,,,,,,Arthropoda,Animalia,"The family Goneplacidae MacLeay, 1838 (Crustacea: Decapoda: Brachyura): systematics, phylogeny, and fossil records",2003,Paleontological Research,0.608,0.824,74,2,45,0.432,0.711,0.373,0.325,0.718,45,3,42,18,1.9,64.6,31.4,69.2,,,,,,
Karasawa_et_Schweitzer_2006a.tnt,Crustacea,,Arthropoda,Ecdysozoa,,,,,,,,,,,,Arthropoda,Animalia,A new classification of the Xanthoidea <em>sensu lato</em> (Crustacea: Decapoda: Brachyura) based on phylogenetic analysis and traditional systematics and evaluation of all fossil Xanthoidea <em>sensu lato</em>,2006,Contributions to Zoology,0.335,0.753,215,2,72,0.353,1,0.252,0.277,0.598,71,2,69,45,2.2,42.2,14.3,47.2,,,,,,
Lamsdell_inpressa.tnt,Xiphosura,,Arthropoda,Ecdysozoa,,,,,,,,,,,,Arthropoda,Animalia,Revised systematics of Palaeozoic 'horseshoe crabs' and the myth of monophyletic Xiphosura,2013,Zoological Journal of the Linnean Society,0.592,0.781,282,12,167,0.312,0.527,0.375,0.262,0.665,114,1,113,37,36.8,49.8,19.5,54.3,,,,,,
Lieberman_1993a.tnt,Trilobita,,Arthropoda,Ecdysozoa,,,,,,,,,,,,Arthropoda,Animalia,"Systematics and biogeography of the &quot;<em>Metacryphaeus</em> Group&quot; Calmoniidae (Trilobita, Devonian), with comments on adaptive radiations and the geological history of the Malvinokaffric Realm",1993,Journal of Paleontology,0.484,0.608,95,8,46,0.011,0.022,0.437,0.333,0.32,38,1,37,17,5.4,19.2,11.4,20.9,,,,,,
Lieberman_1994aa.tnt,Trilobita,,Arthropoda,Ecdysozoa,,,,,,,,,,,,Arthropoda,Animalia,"Evolution of the trilobite subfamily Proetinae Salter, 1864, and the origin, diversification, evolutioanry affinity, and extinction of the Middle Devonian proetid fauna of eastern North America",1994,Bulletin of the American Museum of Natural History,0.487,0.512,80,1,39,0.15,0.308,0.563,0.379,0.099,33,1,32,14,29.2,20.6,10.3,20.4,,,,,,
Lieberman_1994ab.tnt,Trilobita,,Arthropoda,Ecdysozoa,,,,,,,,,,,,Arthropoda,Animalia,"Evolution of the trilobite subfamily Proetinae Salter, 1864, and the origin, diversification, evolutioanry affinity, and extinction of the Middle Devonian proetid fauna of eastern North America",1994,Bulletin of the American Museum of Natural History,0.5,0.614,54,1,27,0.259,0.519,0.447,0.353,0.236,25,5,20,16,16,23.5,9.3,23.5,,,,,,
Lieberman_1994ac.tnt,Trilobita,,Arthropoda,Ecdysozoa,,,,,,,,,,,,Arthropoda,Animalia,"Evolution of the trilobite subfamily Proetinae Salter, 1864, and the origin, diversification, evolutioanry affinity, and extinction of the Middle Devonian proetid fauna of eastern North America",1994,Bulletin of the American Museum of Natural History,0.348,0.42,201,1,70,0.095,0.272,0.371,0.296,0.074,49,2,47,19,5.2,12.2,7.1,13.9,,,,,,
Lieberman_1994ad.tnt,Trilobita,,Arthropoda,Ecdysozoa,,,,,,,,,,,,Arthropoda,Animalia,"Evolution of the trilobite subfamily Proetinae Salter, 1864, and the origin, diversification, evolutioanry affinity, and extinction of the Middle Devonian proetid fauna of eastern North America",1994,Bulletin of the American Museum of Natural History,0.758,0.758,33,1,25,0.212,0.28,0.625,0.4,0.512,20,3,17,10,15.5,38.4,16.8,36.5,,,,,,
Lieberman_1998a.tnt,Trilobita,,Arthropoda,Ecdysozoa,,,,,,,,,,,,Arthropoda,Animalia,Cladistic analysis of the Early Cambrian olenelloid trilobites,1998,Journal of Paleontology,0.31,0.442,435,8,135,0.074,0.237,0.283,0.28,0.168,79,0,79,26,9.3,19.1,10.1,22.8,,,,,,
Lieberman_1999aa.tnt,Trilobita,,Arthropoda,Ecdysozoa,,,,,,,,,,,,Arthropoda,Animalia,"Systematic revision of the Olenelloidea (Trilobita, Cambrian)",1999,Bulletin of the Peabody Museum of Natural History,0.583,0.714,24,22,14,0.167,0.286,0.641,0.512,0.304,13,1,12,12,7.1,21.8,13.2,24.5,,,,,,
Lieberman_1999ab.tnt,Trilobita,,Arthropoda,Ecdysozoa,,,,,,,,,,,,Arthropoda,Animalia,"Systematic revision of the Olenelloidea (Trilobita, Cambrian)",1999,Bulletin of the Peabody Museum of Natural History,0.567,0.567,60,1,34,0.217,0.382,0.597,0.397,0.235,25,0,25,10,5.6,36.1,21.1,42.4,,,,,,
Lieberman_1999ac.tnt,Trilobita,,Arthropoda,Ecdysozoa,,,,,,,,,,,,Arthropoda,Animalia,"Systematic revision of the Olenelloidea (Trilobita, Cambrian)",1999,Bulletin of the Peabody Museum of Natural History,0.423,0.531,52,2,22,0.154,0.364,0.45,0.467,0.139,20,0,20,12,3.3,19.7,11.2,19.6,,,,,,
Lieberman_1999ad.tnt,Trilobita,,Arthropoda,Ecdysozoa,,,,,,,,,,,,Arthropoda,Animalia,"Systematic revision of the Olenelloidea (Trilobita, Cambrian)",1999,Bulletin of the Peabody Museum of Natural History,0.506,0.686,87,6,44,0.207,0.409,0.466,0.379,0.457,35,0,35,18,11.4,31.9,13.7,37.6,,,,,,
Lieberman_1999ae.tnt,Trilobita,,Arthropoda,Ecdysozoa,,,,,,,,,,,,Arthropoda,Animalia,"Systematic revision of the Olenelloidea (Trilobita, Cambrian)",1999,Bulletin of the Peabody Museum of Natural History,0.8,0.75,5,1,4,0.6,0.75,,0.75,0.415,4,0,4,5,0,70.9,46.1,74.2,,,,,,
Lieberman_1999af.tnt,Trilobita,,Arthropoda,Ecdysozoa,,,,,,,,,,,,Arthropoda,Animalia,"Systematic revision of the Olenelloidea (Trilobita, Cambrian)",1999,Bulletin of the Peabody Museum of Natural History,0.714,0.667,7,1,5,0.429,0.6,1,0.4,0.203,5,0,5,6,0,50.8,31.4,57.5,,,,,,
Lieberman_1999ag.tnt,Trilobita,,Arthropoda,Ecdysozoa,,,,,,,,,,,,Arthropoda,Animalia,"Systematic revision of the Olenelloidea (Trilobita, Cambrian)",1999,Bulletin of the Peabody Museum of Natural History,0.724,0.8,29,2,21,0.276,0.381,0.645,0.421,0.617,17,1,16,11,0.5,49.2,24.2,51.6,,,,,,
Lieberman_1999ah.tnt,Trilobita,,Arthropoda,Ecdysozoa,,,,,,,,,,,,Arthropoda,Animalia,"Systematic revision of the Olenelloidea (Trilobita, Cambrian)",1999,Bulletin of the Peabody Museum of Natural History,0.6,0.6,10,1,6,0.4,0.667,0.714,0.429,-0.02,7,1,6,7,4.1,31.4,25.2,31.6,,,,,,
Lieberman_2001a.tnt,Trilobita,,Arthropoda,Ecdysozoa,,,,,,,,,,,,Arthropoda,Animalia,"Phylogenetic analysis of the Olenellina Walcott, 1890 (Trilobita, Cambrian)",2001,Journal of Paleontology,0.324,0.53,253,1,82,0.099,0.305,0.309,0.341,0.221,57,1,56,26,15.7,17.8,8.5,21,,,,,,
Lieberman_et_Kloc_1997a.tnt,Trilobita,,Arthropoda,Ecdysozoa,,,,,,,,,,,,Arthropoda,Animalia,"Evolutionary and biogeographic patterns in the Asteropyginae (Trilobita, Devonian) Delo, 1935",1997,Bulletin of the American Museum of Natural History,0.21,0.486,477,10,100,0.069,0.329,0.176,0.299,0.175,66,5,61,40,5,12.6,5.2,14.3,,,,,,
Lieberman_etal_1991a.tnt,Trilobita,,Arthropoda,Ecdysozoa,,,,,,,,,,,,Arthropoda,Animalia,"Systematics and biogeography of the &quot;<em>Malvinella</em> Group,&quot; Calmoniidae (Trilobita, Devonian)",1991,Journal of Paleontology,0.517,0.642,118,1,61,0.254,0.492,0.497,0.355,0.431,51,0,51,14,12.5,45.8,23.2,53.3,,,,,,
Park_etal_2002a.tnt,Ostracoda,,Arthropoda,Ecdysozoa,,,,,,,,,,,,Arthropoda,Animalia,"Phylogenetic relationships of <em>Gomphocythere</em> (Ostracoda) in Lake Tanganyika, East Africa",2002,Journal of Crustacean Biology,0.516,0.63,91,7,47,0.176,0.341,0.418,0.289,0.365,44,6,38,19,3.8,28.4,16.1,30.5,Cytheride,Leucocyth,Limnocyth,Gomphocyt,Gomphocyt,Gomphocyt
Ramskold_et_Chatterton_1991a.tnt,Trilobita,,Arthropoda,Ecdysozoa,,,,,,,,,,,,Arthropoda,Animalia,Revision and subdivision of the polyphyletic '<em>Leonaspis</em>' (Trilobita),1991,Transactions of the Royal Society of Edinburgh: Earth Sciences,0.344,0.797,163,100000,56,0,0.609,0.196,0.447,0.598,35,0,35,64,23.1,9.5,3.5,10.7,A_cincinn,D_scitula,E_bufo   ,E_acaresc,E_coronat,E_deflexa
Ramskold_et_Werdelin_1991a.tnt,Trilobita,,Arthropoda,Ecdysozoa,,,,,,,,,,,,Arthropoda,Animalia,The phylogeny and evolution of some phacopid trilobites,1991,Cladistics,0.289,0.722,301,36,87,0.176,0.298,0.183,0.353,0.507,32,1,31,48,14.1,26.9,8.2,29.7,Hyp_Anc,Podowrine,A_quadril,A_woodbur,A_sufferi,A_sororia
Rode_et_Babcock_2003a.tnt,Crustacea,,Arthropoda,Ecdysozoa,,,,,,,,,,,,Arthropoda,Animalia,Phylogeny of fossil and extant freshwater crayfish and some closely related nephropid lobsters,2003,Journal of Crustacean Biology,0.277,0.637,191,1488,53,0.094,0.577,0.222,0.417,0.347,31,2,29,47,3,10.8,3.7,13.4,Palaeopal,Eryma_fos,Enoplocly,Homarus_a,Hoplopari,Metanephr
Rode_et_Lieberman_2002a.tnt,Crustacea,,Arthropoda,Ecdysozoa,,,,,,,,,,,,Arthropoda,Animalia,Phylogenetic and biogeographic analysis of Devonian phyllocarid crustaceans,2002,Journal of Paleontology,0.452,0.835,188,3,85,0.261,0.61,0.239,0.405,0.731,54,0,54,43,10.1,28.7,10.8,33.5,Ceratioca,Ceratioca,Aristozoe,Carinatac,Dithryoca,Dithryoca
Schram_etal_1999a.tnt,Thylacocephala,,Arthropoda,Ecdysozoa,,,,,,,,,,,,Arthropoda,Animalia,Thylacocephala (Arthropoda: Crustacea?) from the Cretaceous of Lebanon and implications for thylacocephalan systematics,1999,Palaeontology,0.537,0.597,67,7,36,0,0.11,0.356,0.262,0.209,15,0,15,18,3.3,,,,Concavica,Concavica,Concavica,Concavica,Concavica,Concavica
Shultz_2007a.tnt,arachnid orders,,Arthropoda,Ecdysozoa,,,,,,,,,,,,Arthropoda,Animalia,A phylogenetic analysis of the arachnid orders based on morphological characters,2007,Zoological Journal of the Linnean Society,0.554,0.854,424,18,235,0.271,0.537,0.294,0.232,0.789,202,2,200,59,32.8,50.4,24.3,53.7,Weinbergi,Limuloide,Euproops ,Limulus  ,Tachypleu,Baltoeury
Sundberg_1999aa.tnt,Trilobita,,Arthropoda,Ecdysozoa,,,,,,,,,,,,Arthropoda,Animalia,"Redescription of <em>Alokistocare subcoronatum</em> (Hall and Whitfield, 1877), the type species of <em>Alokistocare</em>, and the status of Alokistocaridae Resser, 1939B (Ptychopariida: Trilobita, Middle Cambrian)",1999,Journal of Paleontology,0.492,0.565,199,11,98,0.211,0,0.417,0.366,0.325,50,2,48,19,7.8,38.7,17.6,45.6,Ptychopar,Eoptychop,Pianaspis,Papyriasp,Amecephal,Amecephal
Sundberg_1999ab.tnt,Trilobita,,Arthropoda,Ecdysozoa,,,,,,,,,,,,Arthropoda,Animalia,"Redescription of <em>Alokistocare subcoronatum</em> (Hall and Whitfield, 1877), the type species of <em>Alokistocare</em>, and the status of Alokistocaridae Resser, 1939B (Ptychopariida: Trilobita, Middle Cambrian)",1999,Journal of Paleontology,0.433,0.548,231,5,100,0.113,0.085,0.52,0.352,0.323,50,2,48,19,7.8,31.2,16.1,33.8,Ptychopar,Eoptychop,Pianaspis,Papyriasp,Amecephal,Amecephal
Sundberg_2004a.tnt,Trilobita,,Arthropoda,Ecdysozoa,,,,,,,,,,,,Arthropoda,Animalia,Cladistic analysis of Early-Middle Cambrian kochaspid trilobites (Ptychopariida),2004,Journal of Paleontology,0.191,0.582,372745,2,71291,0,0.579,0.283,0.249,0.317,70,0,70,66,19.5,11.6,4.8,13.7,Elrathina,Syspaceph,Pachyaspi,Pachyaspi,Ptychopar,Amecephal
Sundberg_et_McCollum_1997a.tnt,Trilobita,,Arthropoda,Ecdysozoa,,,,,,,,,,,,Arthropoda,Animalia,Oryctocephalids (Corynexochida: Trilobita) of the Lower-Middle Cambrian boundary interval from California and Nevada,1997,Journal of Paleontology,0.425,0.508,167,43,71,0.036,0.368,0.353,0.277,0.199,36,3,33,22,4.8,15.8,7.5,17.3,Arthricoc,Changaspi,Lancastri,Opsiosory,Oryctocep,Oryctocep
Taylor_etal_1998a.tnt,Crustacea,,Arthropoda,Ecdysozoa,,,,,,,,,,,,Arthropoda,Animalia,New pygocephalomorph crustaceans from the Permian of China and their phylogenetic relationships,1998,Palaeontology,0.406,0.62,128,1085,52,0.039,0.074,0.4,0.279,0.321,33,2,31,31,10,12.8,6.5,13.5,Hypotheti,Lophogast,Gnathopha,Paralopho,Eucopia_u,Chalarasp
Tinn_et_Meidla_2004aa.tnt,Ostracoda,,Arthropoda,Ecdysozoa,,,,,,,,,,,,Arthropoda,Animalia,Phylogenetic relationships of Early-Middle Ordovician ostracods of Baltoscandia,2004,Palaeontology,0.512,0.787,86,492,44,0.302,0.147,0.311,0.32,0.605,44,9,35,35,14.8,20.1,6.4,19.8,Hesslando,Nanopsis_,Unisulcop,H_proximu,D_lauta  ,B_angusto
Tinn_et_Meidla_2004ab.tnt,Ostracoda,,Arthropoda,Ecdysozoa,,,,,,,,,,,,Arthropoda,Animalia,Phylogenetic relationships of Early-Middle Ordovician ostracods of Baltoscandia,2004,Palaeontology,0.479,0.782,94,112,45,0.181,0.286,0.277,0.288,0.583,44,9,35,35,14.8,22.1,6.8,21.4,Hesslando,Nanopsis_,Unisulcop,H_proximu,D_lauta  ,B_angusto
Waisfeld_etal_2001a,Trilobita,,Arthropoda,Ecdysozoa,,,,,,,,,,,,Arthropoda,Animalia,"Systematics of Shumardiidae (Trilobita), with new species from the Ordovician of Argentina",2001,Journal of Paleontology,0.233,0.477,424,8,99,0.064,0.273,0.221,0.328,0.173,52,0,52,43,10.9,16.6,7.1,19.5,,,,,,
Westrop_etal_1996aa,Trilobita,,Arthropoda,Ecdysozoa,,,,,,,,,,,,Arthropoda,Animalia,"Marjuman (Cambrian) agnostoid trilobites of the Cow Head Group, western Newfoundland",1996,Journal of Paleontology,0.309,0.711,139,1942,43,0.065,0.21,0.205,0.405,0.452,28,0,28,44,5,17,6.3,19.1,,,,,,
Westrop_etal_1996ab,Trilobita,,Arthropoda,Ecdysozoa,,,,,,,,,,,,Arthropoda,Animalia,"Marjuman (Cambrian) agnostoid trilobites of the Cow Head Group, western Newfoundland",1996,Journal of Paleontology,0.318,0.7,132,67640,42,0.061,0.191,0.217,0.382,0.43,28,0,28,44,5,14.5,5.3,17,,,,,,
Wheeler_et_Hayashi_1998a,chelicerate orders,,Arthropoda,Ecdysozoa,,,,,,,,,,,,Arthropoda,Animalia,The phylogeny of the extant chelicerate orders,1998,Cladistics,0.527,0.648,188,9,99,0.133,0.252,0.411,0.365,0.47,93,14,79,17,15,47.2,25.4,52.4,,,,,,
Yuan_etal_2006a,Trilobita,,Arthropoda,Ecdysozoa,,,,,,,,,,,,Arthropoda,Animalia,Ontogeny and relationships of the trilobite <em>Pseudopetigurus</em> Pranti and Pribyl,2006,Palaeontology,0.565,0.714,69,14,39,0.348,0.616,0.454,0.477,0.505,25,1,24,17,5.6,45.9,19.3,49,,,,,,
Alvarez_etal_1998a.tnt,,,Brachiopoda,Brachiopoda,,,,,,,,,,,,Brachiopoda,Animalia,The classification of athyridid brachiopods,1998,Journal of Paleontology,0.484,0.804,364,1,176,0.242,0.5,0.519,0.616,0.534,37,3,34,37,3.8,28.2,10.4,28.2,,,,,,
Cusack_etal_1999a.tnt,,,Brachiopoda,Brachiopoda,,,,,,,,,,,,Brachiopoda,Animalia,Chemico-structural evolution of linguloid brachiopod shells,1999,Palaeontology,0.481,0.638,154,12,74,0.26,0.54,0.347,0.25,0.411,46,4,42,23,2.4,23.1,9,25.2,,,,,,
Dewing_2004a.tnt,,,Brachiopoda,Brachiopoda,,,,,,,,,,,,Brachiopoda,Animalia,"Shell structure and its bearing on the phylogeny of Late Ordovician-Early Silurian strophomenoid brachiopods from Anticosti Island, Quebec",2004,Journal of Paleontology,0.564,0.712,39,4,22,0.231,0.409,0.404,0.387,0.417,15,2,13,15,0,20.7,11,22.8,,,,,,
Jin_etal_2006a.tnt,,,Brachiopoda,Brachiopoda,,,,,,,,,,,,Brachiopoda,Animalia,Taxonomic reassessment of two virgianid brachiopod genera from the Upper Ordovician and Lower Silurian of South China,2006,Journal of Paleontology,0.591,0.578,66,18,39,0.03,0.051,0.486,0.31,0.23,24,5,19,12,0,20.9,13.2,22.4,,,,,,
Leighton_et_Maples_2002a.tnt,,,Brachiopoda,Brachiopoda,,,,,,,,,,,,Brachiopoda,Animalia,"Evaluating internal versus external characters: phylogenetic analyses of the Echinoconchidae, Buxtoniinae, and Juresaniinae (Phylum Brachiopoda)",2002,Journal of Paleontology,0.569,0.728,51,1,29,0.275,0.482,0.485,0.365,0.547,24,0,24,14,1.5,52.3,23.6,56.1,,,,,,
Monks_et_Owen_2000a.tnt,,,Brachiopoda,Brachiopoda,,,,,,,,,,,,Brachiopoda,Animalia,"Phylogeny of <em>Orbirhynchia</em> Pettitt, 1954 (Brachiopoda: Rhynchonellida)",2000,Palaeontology,0.593,0.782,54,10,32,0.259,0.437,0.438,0.368,0.613,22,1,21,17,0,29.8,15.6,30.2,,,,,,
Popov_etal_1999a.tnt,,,Brachiopoda,Brachiopoda,,,,,,,,,,,,Brachiopoda,Animalia,The earliest atrypides and athyridides (Brachiopoda) from the Ordovician of Kazakhstan,1999,Palaeontology,0.53,0.674,134,6,71,0,0.267,0.337,0.272,0.459,27,2,25,25,3.6,25.7,10,30.8,Oligorhyn,Ancistror,Cyclospir,Rozmanosp,Pectenosp,Manespira
Rode_2005aa.tnt,,,Brachiopoda,Brachiopoda,,,,,,,,,,,,Brachiopoda,Animalia,Systematic revision of the Middle and Late Devonian Brachiopods <em>Schizophoria (Schizophoria)</em> and '<em>Schuchertella</em>' from North America,2005,Journal of Systematic Palaeontology,0.3,0.526,130,307,39,0.015,0.256,0.239,0.201,0.135,36,2,34,25,8.8,10.4,5.2,11.8,S_Rhenosc,S_Eoschiz,S_Eoschiz,S_Eoschiz,S_Schizop,S_Schizop
Rode_2005ab.tnt,,,Brachiopoda,Brachiopoda,,,,,,,,,,,,Brachiopoda,Animalia,Systematic revision of the Middle and Late Devonian Brachiopods <em>Schizophoria (Schizophoria)</em> and '<em>Schuchertella</em>' from North America,2005,Journal of Systematic Palaeontology,0.413,0.614,104,6,43,0.106,0.34,0.42,0.457,0.284,36,0,36,18,12.7,16.4,8.9,19.7,Xystostro,Xystostro,Schuchert,Schuchert,Floweria_,Floweria_
Alvarado-Ortega_et_Espinosa-Arrubarrena_2008a.tnt,Halecomorphi,,Actinopterygii,Actinopterygii,,,,,,,,,,Osteichthyes,Gnathostomata,Chordata,Animalia,"A new genus of ionoscopiform fish (Halecomorphi) from the Lower Cretaceous (Albian) Lithographic Limestones of the Tlayua Quarry, Puebla, Mexico",2008,Journal of Paleontology,0.957,0.958,23,1,22,0.435,0.454,0.486,0.326,0.907,23,9,14,7,11.2,100,48.2,82.4,,,,,,
Arratia_1996a.tnt,Teleostei,,Actinopterygii,Actinopterygii,,,,,,,,,,Osteichthyes,Gnathostomata,Chordata,Animalia,Reassessment of the phylogenetic relationships of certain Jurassic teleosts and their implications on teleostean phylogeny,1996,Mesozoic Fishes - Systematics and Paleoecology,0.434,0.689,265,29,115,0.17,0.391,0.299,0.241,0.524,90,4,86,28,11.5,40,18.5,44.7,,,,,,
Brito_etal_2008a.tnt,Halecomorphi,,Actinopterygii,Actinopterygii,,,,,,,,,,Osteichthyes,Gnathostomata,Chordata,Animalia,"New amiid fish (Halecomorphi: Amiiformes) from the Lower Cretaceous Crato Formation, Araripe Basin, Northeast Brazil",2008,Journal of Vertebrate Paleontology,0.658,0.902,111,245,73,0.261,0.397,0.302,0.27,0.84,69,6,63,45,20.3,23.1,7.6,24.5,,,,,,
Dietze_2000a.tnt,paramblypterid and amblypterid,,Actinopterygii,Actinopterygii,,,,,,,,,,Osteichthyes,Gnathostomata,Chordata,Animalia,A revision of paramblypterid and amblypterid actinopterygians from Upper Carboniferous-Lower Permian lacustrine deposits of Central Europe,2000,Palaeontology,0.224,0.572,401,161,90,0.102,0.456,0.215,0.314,0.307,57,0,57,50,6.9,11.2,5.5,14.2,,,,,,
Gardiner_etal_2005a.tnt,lower actinopterygii,,Actinopterygii,Actinopterygii,,,,,,,,,,Osteichthyes,Gnathostomata,Chordata,Animalia,A review of the lower actinopterygian phylogeny,2005,Zoological Journal of the Linnean Society,0.772,0.785,101,6,78,0.158,0.205,0.462,0.298,0.648,38,5,33,15,5.8,53.3,26.2,52.7,,,,,,
Grande_et_Bemis_1998a.tnt,Amiidae,,Actinopterygii,Actinopterygii,,,,,,,,,,Osteichthyes,Gnathostomata,Chordata,Animalia,A comprehensive phylogenetic study of amiid fishes (Amiidae) based on comparative skeletal anatomy: an empirical search for interconnected patterns of natural history,1998,Memoirs of the Society of Vertebrate Paleontology,0.664,0.901,110,175,73,0.182,0.274,0.295,0.247,0.835,69,6,63,44,20.4,22.9,8.1,24.6,,,,,,
Grande_et_Poyato-Ariza_1999a.tnt,Gonorynchiforms,,Actinopterygii,Actinopterygii,,,,,,,,,,Osteichthyes,Gnathostomata,Chordata,Animalia,Phylogenetic relationships of fossil and Recent gonorynchiform fishes (Teleostei: Ostariophysi),1999,Zoological Journal of the Linnean Society,0.679,0.848,137,14,93,0.197,0.29,0.309,0.21,0.77,94,23,71,22,15.8,49.7,22,52.4,,,,,,
Hilton_2003a.tnt,Osteoglossomorpha,,Actinopterygii,Actinopterygii,,,,,,,,,,Osteichthyes,Gnathostomata,Chordata,Animalia,"Comparative osteology and phylogenetic systematics of fossil and living bony-tongue fishes (Actinopterygii, Teleostei, Osteoglossomorpha)",2003,Zoological Journal of the Linnean Society,0.609,0.778,156,2,95,0.256,0.421,0.337,0.259,0.653,72,7,65,20,19,58.1,24.9,61,,,,,,
Li_et_Wilson_1996a.tnt,Osteoglossomorpha,,Actinopterygii,Actinopterygii,,,,,,,,,,Osteichthyes,Gnathostomata,Chordata,Animalia,"The discovery of Heterotidinae (Teleostei: Osteoglossidae) from the Paleocene Paskapoo Formation of Alberta, Canada",1996,Journal of Vertebrate Paleontology,0.683,0.814,41,1,28,0.488,0.714,0.527,0.353,0.671,28,3,25,12,9.8,81,32.1,77.1,,,,,,
Long_etal_2008a.tnt,basal actinopterygii,,Actinopterygii,Actinopterygii,,,,,,,,,,Osteichthyes,Gnathostomata,Chordata,Animalia,A new basal actinopterygian fish from the Middle Devonian Aztec Siltstone of Antarctica,2008,Antarctic Science,0.458,0.651,179,1,82,0.196,0.427,0.346,0.298,0.454,71,3,68,19,17.9,43.7,20.5,47.9,,,,,,
Lund_et_Poplin_2002a.tnt,tarrasiids,,Actinopterygii,Actinopterygii,,,,,,,,,,Osteichthyes,Gnathostomata,Chordata,Animalia,Cladistic analysis of the relationships of the tarrasiids (Lower Carboniferous actinopterygians),2002,Journal of Vertebrate Paleontology,0.561,0.634,212,1,119,0.123,0.219,0.396,0.247,0.454,75,7,68,17,4.5,32,20.2,33.2,,,,,,
Lund_etal_1995a.tnt,Paleozoic actinopterygii,,Actinopterygii,Actinopterygii,,,,,,,,,,Osteichthyes,Gnathostomata,Chordata,Animalia,Preliminary analysis of the interrelationships of some Paleozoic actinopterygians,1995,Geobios (MS),0.512,0.558,244,6,125,0.07,0.136,0.403,0.187,0.369,74,10,64,20,2.1,29.7,16.1,32.8,,,,,,
Murray_etal_2010a.tnt,Osteoglossomorpha,,Actinopterygii,Actinopterygii,,,,,,,,,,Osteichthyes,Gnathostomata,Chordata,Animalia,"A new Cretaceous osteoglossomorph fish from Gansu Province, China",2010,Journal of Vertebrate Paleontology,0.477,0.745,241,45,115,0.174,0.365,0.296,0.287,0.61,87,5,82,30,26.4,35.2,18.1,37.3,,,,,,
